Cites,Authors,Title,Year,Source,Publisher,ArticleURL,CitesURL,GSRank,QueryDate,Type,DOI,ISSN,CitationURL,Volume,Issue,StartPage,EndPage,ECC,CitesPerYear,CitesPerAuthor,AuthorCount,Age,Abstract
0,"Y Zhang, S Liu, C Li, J Wang","Rethinking the Dice Loss for Deep Learning Lesion Segmentation in Medical Images",2021,"Journal of Shanghai Jiaotong University …","Springer","https://link.springer.com/article/10.1007/s12204-021-2264-x","",92,"2021-02-09 16:34:33","","","","",,,,,0,0.00,0,4,1,"Page 1. J. Shanghai Jiao Tong Univ. (Sci.), 2021, 26(1): 93-102 https://doi.org/10.1007/ s12204-021-2264-x Rethinking the Dice Loss for Deep Learning Lesion Segmentation in Medical Images ZHANG Yue 1,2 (张 月), LIU Shijie …"
0,"M Yeo, B Tahayori, HK Kok, J Maingard…","Review of deep learning algorithms for the automatic detection of intracranial hemorrhages on computed tomography head imaging",2021,"Journal of …","jnis.bmj.com","https://jnis.bmj.com/content/early/2021/01/20/neurintsurg-2020-017099.abstract","",93,"2021-02-09 16:34:33","","","","",,,,,0,0.00,0,5,1,"Skip to main content. Viewing from: Google Indexer. BMJ Journals. Subscribe; Log In More Log in via Institution. Log in via OpenAthens. Log in via your Society Select your society SNIS ESMINT. Log in using your username and password …"
1,"LM Lopez-Ramos…","Online hyperparameter search interleaved with proximal parameter updates",2021,"2020 28th European …","ieeexplore.ieee.org","https://ieeexplore.ieee.org/abstract/document/9287537/","https://scholar.google.com/scholar?cites=10997180521747189359&as_sdt=2005&sciodt=0,5&hl=en",94,"2021-02-09 16:34:33","","","","",,,,,1,1.00,1,2,1,"… Although there are many HO algorithms available (see [3, Ch. 1] for a recent review of the state of the art), it is still an extended practice to search for (sub)optimal hyperparameters using grid search or random search [1], [4], because of their simplicity …"
0,"DW Lee, SY Kim, SN Jeong, JH Lee","Artificial Intelligence in Fractured Dental Implant Detection and Classification: Evaluation Using Dataset from Two Dental Hospitals",2021,"Diagnostics","mdpi.com","https://www.mdpi.com/985314","",95,"2021-02-09 16:34:33","","","","",,,,,0,0.00,0,4,1,"Fracture of a dental implant (DI) is a rare mechanical complication that is a critical cause of DI failure and explantation. The purpose of this study was to evaluate the reliability and validity of a three different deep convolutional neural network (DCNN) architectures (VGGNet-19, GoogLeNet …"
0,"J Fernández-Lozano, E Sanz-Ablanedo","Unraveling the Morphological Constraints on Roman Gold Mining Hydraulic Infrastructure in NW Spain. A UAV-Derived Photogrammetric and Multispectral Approach",2021,"Remote Sensing","mdpi.com","https://www.mdpi.com/962242","",96,"2021-02-09 16:34:33","","","","",,,,,0,0.00,0,2,1,"The province of León preserves a unique hydraulic infrastructure 1200 km-long, used for the exploitation of auriferous deposits in Roman times. It represents the most extensive waterworks in Europe and is one of the best-preserved examples of mining heritage in Antiquity. In this …"
113,"W Wang, Q Lai, H Fu, J Shen, H Ling…","Salient object detection in the deep learning era: An in-depth survey",2021,"IEEE Transactions on …","ieeexplore.ieee.org","https://ieeexplore.ieee.org/abstract/document/9320524/","https://scholar.google.com/scholar?cites=16571016204509611576&as_sdt=2005&sciodt=0,5&hl=en",97,"2021-02-09 16:34:33","","","","",,,,,113,113.00,19,6,1,"… methods. Since the first introduction in 2015 [26]–[28], deep learning-based SOD (or deep SOD) algorithms have quickly shown superior performance over traditional solutions, and have continued to improve the state-of-the-art …"
0,"G Papadimitriou, C Wang, K Vahi, RF da Silva…","End-to-end online performance data capture and analysis for scientific workflows",2021,"Future Generation …","Elsevier","https://www.sciencedirect.com/science/article/pii/S0167739X20330570","",98,"2021-02-09 16:34:33","","","","",,,,,0,0.00,0,5,1,"… to-end data collection of workflow performance data is an important resource of training data for automated machine learning analysis … of workflow systems executing many scientific applications from diverse domains in production [1], the current state-of-the-art approaches lack …"
0,"F Su, H Zhu, T Chen, L Li, F Yang, H Peng…","An anchor-based graph method for detecting and classifying indoor objects from cluttered 3D point clouds",2021,"ISPRS Journal of …","Elsevier","https://www.sciencedirect.com/science/article/pii/S0924271620303452","",99,"2021-02-09 16:34:33","","","","",,,,,0,0.00,0,7,1,"JavaScript is disabled on your browser. Please enable JavaScript to use all the features on this page. Skip to main content Skip to article …"
0,"D Sandoval, U Leturiondo, Y Vidal, F Pozo","Entropy Indicators: An Approach for Low-Speed Bearing Diagnosis",2021,"Sensors","mdpi.com","https://www.mdpi.com/976002","",100,"2021-02-09 16:34:33","","","","",,,,,0,0.00,0,4,1,"To increase the competitiveness of wind energy, the maintenance costs of offshore floating and fixed wind turbines need to be reduced. One strategy is the enhancement of the condition monitoring techniques for pitch bearings, because their low operational speed and the high loads …"
0,"MA El Sayed, ESM Saad, RF Aly, SM Habashy","Energy-Efficient Task Partitioning for Real-Time Scheduling on Multi-Core Platforms",2021,"Computers","mdpi.com","https://www.mdpi.com/2073-431X/10/1/10","",101,"2021-02-09 16:34:33","","","","",,,,,0,0.00,0,4,1,"Next Article in Journal An Empirical Review of Automated Machine Learning. Previous Article in Journal Simulation and Analysis of Self-Replicating … for the classical Worst-First heuristic, and then they introduced their technique that overcomes many state-of-the-art limitations …"
0,"A Crisan, B Fiore-Gartland","Fits and Starts: Enterprise Use of AutoML and the Role of Humans in the Loop",2021,"arXiv preprint arXiv:2101.04296","arxiv.org","https://arxiv.org/abs/2101.04296","",102,"2021-02-09 16:34:33","","","","",,,,,0,0.00,0,2,1,"… human-in-the-loop interactions for AutoML. Two prior and comprehensive state-of-the-art surveys capture the role of visual- ization in explaining [7] and building trust [8] in machine learning. Recent work by Yuan [51] demonstrates …"
0,"J Han, Z Zhang, M Pantic, B Schuller","Internet of emotional people: Towards continual affective computing cross cultures via audiovisual signals",2021,"Future Generation Computer …","Elsevier","https://www.sciencedirect.com/science/article/pii/S0167739X20302594","",103,"2021-02-09 16:34:33","","","","",,,,,0,0.00,0,4,1,"… Although this issue can be partially solved by certain technologies like automated Machine Learning (autoML) that lets machines automatically construct the model structure without exhausting human interference [16], [17], it is somewhat pragmatically unfeasible to implement …"
0,"J Muesing, N Ahmed, L Burks, M Iuzzolino…","Fully Bayesian Human–Machine Data Fusion for Robust Online Dynamic Target Characterization",2021,"Journal of Aerospace …","arc.aiaa.org","https://arc.aiaa.org/doi/abs/10.2514/1.I010832","",104,"2021-02-09 16:34:33","","","","",,,,,0,0.00,0,5,1,"… The key idea is to allow operators to communicate directly with automated machine learning algorithms via user-friendly graphical … human reasoning to fill in automated machine perception/reasoning gaps, the performance and robustness of state-of-the-art automated …"
0,"X Gong, T Brabham, C Chu","Adapting a sequence model for use in predicting future device interactions with a computing system",2021,"US Patent App. 16/978,653","Google Patents","https://patents.google.com/patent/US20210004682A1/en","",105,"2021-02-09 16:34:33","","","","",,,,,0,0.00,0,3,1,"US20210004682A1 - Adapting a sequence model for use in predicting future device interactions with a computing system - Google Patents. Adapting a sequence model for use in predicting future device interactions with a computing system. Download PDF Info …"
0,"W Jiang, J Luo","Graph Neural Network for Traffic Forecasting: A Survey",2021,"arXiv preprint arXiv:2101.11174","arxiv.org","https://arxiv.org/abs/2101.11174","",106,"2021-02-09 16:34:33","","","","",,,,,0,0.00,0,2,1,"… In recent years, to model the graph structures in the transportation systems as well as the contextual information, graph neural networks (GNNs) are introduced as new tools and have achieved the state-of- the-art performance in a series of traffic forecasting problems …"
0,"W Sun, RD Braatz","Smart process analytics for predictive modeling",2021,"Computers & Chemical Engineering","Elsevier","https://www.sciencedirect.com/science/article/pii/S0098135420304555","",107,"2021-02-09 16:34:33","","","","",,,,,0,0.00,0,2,1,"JavaScript is disabled on your browser. Please enable JavaScript to use all the features on this page. Skip to main content Skip to article …"
0,"K Yuan, Y Zhang, Y Li, HT Zheng…","A Knowledge-Enhanced Multi-View Framework for Drug-Target Interaction Prediction",2021,"IEEE Transactions on …","ieeexplore.ieee.org","https://ieeexplore.ieee.org/abstract/document/9324998/","",108,"2021-02-09 16:34:33","","","","",,,,,0,0.00,0,5,1,"… attention to bridge different drug data and emphasize crucial information between var- ious drug feature pairs; 3) Experimental results show that KEMV enables us to suggest many potential drug-target interactions and has competitive performance with state-of- the-art methods …"
0,"YR Shrestha, V Krishna, G von Krogh","Augmenting organizational decision-making with deep learning algorithms: Principles, promises, and challenges",2021,"Journal of Business Research","Elsevier","https://www.sciencedirect.com/science/article/pii/S0148296320306512","",109,"2021-02-09 16:34:33","HTML","","","",,,,,0,0.00,0,3,1,"JavaScript is disabled on your browser. Please enable JavaScript to use all the features on this page. Skip to main content Skip to article …"
0,"N Kulathunga, NR Ranasinghe, D Vrinceanu…","Effects of Nonlinearity and Network Architecture on the Performance of Supervised Neural Networks",2021,"Algorithms","mdpi.com","https://www.mdpi.com/988138","",110,"2021-02-09 16:34:33","","","","",,,,,0,0.00,0,4,1,"… [10]. As a method that applies a variable non-linearity into ReLU, the activation L-ReLU was discussed in parallel to the introduction of ReLU in deep learning [8]. Nwankpa et al., compares the effects of activation functions with the state-of-the-art research results and outline the …"
0,"X Song, K Choromanski, J Parker-Holder…","ES-ENAS: Combining Evolution Strategies with Neural Architecture Search at No Extra Cost for Reinforcement Learning",2021,"arXiv preprint arXiv …","arxiv.org","https://arxiv.org/abs/2101.07415","",111,"2021-02-09 16:34:33","","","","",,,,,0,0.00,0,4,1,"… Interest in NAS algorithms started to grow rapidly when it was shown that they can design state-of-the- art architectures for image recognition and language modeling [61] … Indeed, [26] do achieve state- of-the-art results on various supervised feedforward and recurrent models …"
0,"S Mo, Y Zhong, X Shi, W Feng, X Yin, J Wu","Filling the gap between GRACE-and GRACE-FO-derived terrestrial water storage anomalies with Bayesian convolutional neural networks",2021,"arXiv preprint arXiv …","arxiv.org","https://arxiv.org/abs/2101.09361","",112,"2021-02-09 16:34:33","","","","",,,,,0,0.00,0,6,1,"… The comparisons with hydrological model outputs and previous studies further suggest that BCNN obtains a state-of-the-art performance in bridging the gap at a global scale … Reconstruction of GRACE total water storage through automated machine learning …"
0,"N Barzegar, T Khatibi, AH Sabet","Proposing novel methods for simultaneous cardiac cycle phase identification and estimating maximal and minimal left atrial volume (LAV) from apical four …",2021,"Informatics in Medicine Unlocked","Elsevier","https://www.sciencedirect.com/science/article/pii/S2352914821000071","",113,"2021-02-09 16:34:33","HTML","","","",,,,,0,0.00,0,3,1,"… the features extracted from the images. Other state-of-the-art methods which have been used for continuous value prediction from the images are end-to-end Convolutional Neural Networks (CNNs). However, to the best of our …"
0,"DR Seshadri, ML Thom, ER Harlow…","Wearable Technology and Analytics as a Complementary Toolkit to Optimize Workload and to Reduce Injury Burden",2021,"Frontiers in Sports and …","frontiersin.org","https://www.frontiersin.org/articles/10.3389/fspor.2020.630576/full?&utm_source=Email_to_authors_&utm_medium=Email&utm_content=T1_11.5e1_author&utm_campaign=Email_publication&field=&journalName=Frontiers_in_Sports_and_Active_Living&id=630576","",114,"2021-02-09 16:34:33","HTML","","","",,,,,0,0.00,0,4,1,"… tree-model was more effective – with 80% sensitivity and 50% specificity in cases of injury – than state-of-the-art controls, such as … morphometric features were found to significantly differ between groups which were used to develop an automated machine learning classifier for …"
0,"H Benmeziane, KE Maghraoui, H Ouarnoughi…","A Comprehensive Survey on Hardware-Aware Neural Architecture Search",2021,"arXiv preprint arXiv …","arxiv.org","https://arxiv.org/abs/2101.09336","",115,"2021-02-09 16:34:33","","","","",,,,,0,0.00,0,4,1,"… architectures. NAS has been extensively studied in the past few years. Arguably their most significant impact has been in image classification and object detection tasks where the state of the art results have been obtained. Despite …"
0,"A Adadi","A survey on data‐efficient algorithms in big data era",2021,"Journal of Big Data","Springer","https://link.springer.com/article/10.1186/s40537-021-00419-9","",116,"2021-02-09 16:34:33","HTML","","","",,,,,0,0.00,0,1,1,"The leading approaches in Machine Learning are notoriously data-hungry. Unfortunately, many application domains do not have access to big data because acquiring data involves a process that is expensive or time-consuming. This has triggered a serious debate in both the industrial …"
0,"S Jeon, J Son, M Park, BS Ko, SH Son","Driving-PASS: A Driving Performance Assessment System for Stroke Drivers Using Deep Features",2021,"IEEE Access","ieeexplore.ieee.org","https://ieeexplore.ieee.org/abstract/document/9343246/","",117,"2021-02-09 16:34:33","","","","",,,,,0,0.00,0,5,1,"… Second, we complement additional technical methods in the system's functional components, ie, Feature engineer- ing, Resampling, Automated Machine Learning (Auto-ML), to enhance the performance of Driving-PASS. III …"
0,"S Zheng, Y Wang, B Li, X Li","A Hardware-adaptive Deep Feature Matching Pipeline for Real-time 3D Reconstruction",2021,"Computer-Aided Design","Elsevier","https://www.sciencedirect.com/science/article/pii/S0010448520301779","",118,"2021-02-09 16:34:33","","","","",,,,,0,0.00,0,4,1,"… A real-time 3D reconstruction system with state-of-the-art performance. Abstract … A state-of-the-art performance is achieved through ORB-SLAM2 [2]. The ORB descriptor is a binary vector allowing high performance matching …"
0,"F Shriver, C Gentry, J Watson","Prediction of Neutronics Parameters Within a Two-Dimensional Reflective PWR Assembly Using Deep Learning",2021,"Nuclear Science and Engineering","Taylor & Francis","https://www.tandfonline.com/doi/abs/10.1080/00295639.2020.1852021","",119,"2021-02-09 16:34:33","","","","",,,,,0,0.00,0,3,1,"Page 1. Prediction of Neutronics Parameters Within a Two-Dimensional Reflective PWR Assembly Using Deep Learning Forrest Shriver, a* Cole Gentry, b and Justin Watson a aUniversity of Florida, Department of Materials …"
0,"X Li, J Yang, J Ma","Recent developments of content-based image retrieval (CBIR)",2021,"Neurocomputing","Elsevier","https://www.sciencedirect.com/science/article/pii/S0925231220319044","",120,"2021-02-09 16:34:33","","","","",,,,,0,0.00,0,3,1,""
3,"D Wang, L Wang, Z Zhang, D Wang, H Zhu…",""" Brilliant AI Doctor"" in Rural China: Tensions and Challenges in AI-Powered CDSS Deployment",2021,"arXiv preprint arXiv …","arxiv.org","https://arxiv.org/abs/2101.01524","https://scholar.google.com/scholar?cites=3402896115743905184&as_sdt=2005&sciodt=0,5&hl=en",121,"2021-02-09 16:34:33","","","","",,,,,3,3.00,1,6,1,"… Unlike 'traditional' CDSS that relies on expert-defined heuristics, modern AI-driven CDSS interventions utilize state-of-the-art AI algorithms (eg, deep neural networks and knowledge graph) to train tremendously large datasets retrieved from electronic health record (EHR …"
0,"S Cao, D Zhao, Y Sun, C Ruan","Learning-based low-illumination image enhancer for underwater live crab detection",2021,"ICES Journal of Marine …","academic.oup.com","https://academic.oup.com/icesjms/advance-article-abstract/doi/10.1093/icesjms/fsaa250/6104240","",122,"2021-02-09 16:34:33","","","","",,,,,0,0.00,0,4,1,"Abstract. Swift, non-destructive detection approaches should address the problem of insufficient sensitivity when attempting to obtain and perceive live crab in."
0,"Y Masuda, A Zimmermann, M Viswanathan, M Bass…","Adaptive Enterprise Architecture for the Digital Healthcare Industry: A Digital Platform for Drug Development",2021,"Information","mdpi.com","https://www.mdpi.com/986652","",123,"2021-02-09 16:34:33","","","","",,,,,0,0.00,0,5,1,"Enterprise architecture (EA) is useful for effectively structuring digital platforms with digital transformation in information societies. Moreover, digital platforms in the healthcare industry accelerate and increase the efficiency of drug discovery and development processes. However …"
0,"S Piat, S Miao, R Liao, T Mansi…","Dilated Fully Convolutional Network for 2D/3D Medical Image Registration",2021,"US Patent App. 17 …","Google Patents","https://patents.google.com/patent/US20210012514A1/en","",124,"2021-02-09 16:34:33","","","","",,,,,0,0.00,0,5,1,"US20210012514A1 - Dilated Fully Convolutional Network for 2D/3D Medical Image Registration - Google Patents. Dilated Fully Convolutional Network for 2D/3D Medical Image Registration. Download PDF Info. Publication number …"
0,"R Avtar, A Kouser, A Kumar, D Singh, P Misra, A Gupta…","Remote Sensing for International Peace and Security: Its Role and Implications",2021,"Remote Sensing","mdpi.com","https://www.mdpi.com/975938","",125,"2021-02-09 16:34:33","","","","",,,,,0,0.00,0,7,1,"Remote sensing technology has seen a massive rise in popularity over the last two decades, becoming an integral part of our lives. Space-based satellite technologies facilitated access to the inaccessible terrains, helped humanitarian teams, support complex emergencies, and …"
0,"S Zamani, H Hemmati","A Pragmatic Approach for Hyper-Parameter Tuning in Search-based Test Case Generation",2021,"arXiv preprint arXiv:2101.05738","arxiv.org","https://arxiv.org/abs/2101.05738","",126,"2021-02-09 16:34:33","","","","",,,,,0,0.00,0,2,1,"Page 1. Noname manuscript No. (will be inserted by the editor) A Pragmatic Approach for Hyper-Parameter Tuning in Search-based Test Case Generation Shayan Zamani · Hadi Hemmati Received: date / Accepted: date Abstract …"
0,"D Bouneffouf","Etat de l'art sur l'application des bandits multi-bras",2021,"arXiv preprint arXiv:2101.00001","arxiv.org","https://arxiv.org/abs/2101.00001","",127,"2021-02-09 16:34:33","","","","",,,,,0,0.00,0,1,1,"… [22] D. Bouneffouf, “Exponentiated gradient exploration for active learning,” Computers, vol. 5, no. 1, p. 1, 2016. [23] D. Bouneffouf, “Evolution of the user's content: An overview of the state of the art,” arXiv preprint arXiv:1305.1787, 2013 …"
0,"LA Cox Jr","Modeling Nonlinear Dose-Response Functions: Regression, Simulation, and Causal Networks",2021,"Quantitative Risk Analysis of Air Pollution Health …","Springer","https://link.springer.com/chapter/10.1007/978-3-030-57358-4_2","",128,"2021-02-09 16:34:33","","","","",,,,,0,0.00,0,1,1,"… variables, data permitting. Other investigators (or automated machine-learning programs for learning BNs directly from data) might select additional markers and perhaps get narrower uncertainty bands. In addition, durations …"
