Cites,Authors,Title,Year,Source,Publisher,ArticleURL,CitesURL,GSRank,QueryDate,Type,DOI,ISSN,CitationURL,Volume,Issue,StartPage,EndPage,ECC,CitesPerYear,CitesPerAuthor,AuthorCount,Age,Abstract
17,"S Akila, US Reddy","Cost-sensitive Risk Induced Bayesian Inference Bagging (RIBIB) for credit card fraud detection",2018,"Journal of computational science","Elsevier","https://www.sciencedirect.com/science/article/pii/S1877750317311729","https://scholar.google.com/scholar?cites=1185497276605301652&as_sdt=2005&sciodt=0,5&hl=en",413,"2021-02-09 14:33:32","","","","",,,,,17,5.67,9,2,3,"… Promising cost effective results compared to existing state-of-the-art models were obtained … The extensive adoption of cashless transactions has led to increased transaction data being generated, necessitating the use of automated machine learning models for identifying frauds …"
3,"A Khandelwal","ORBIT (Ordering Based Information Transfer): A Physics Guided Machine Learning Framework to Monitor the Dynamics of Water Bodies at a Global Scale",2019,"","conservancy.umn.edu","https://conservancy.umn.edu/handle/11299/206249","https://scholar.google.com/scholar?cites=9539903763028184807&as_sdt=2005&sciodt=0,5&hl=en",414,"2021-02-09 14:33:32","","","","",,,,,3,1.50,3,1,2,"… issues (sensor anomalies and atmospheric disturbances) and heterogeneity in the land surface, even state of the art machine learning algorithms perform poorly when applied … on their geographical context. Hence, the state-of-the-art machine learning methods for …"
5,"M Yamaç, M Ahishali, N Passalis…","Reversible privacy preservation using multi-level encryption and compressive sensing",2019,"2019 27th European …","ieeexplore.ieee.org","https://ieeexplore.ieee.org/abstract/document/8903056/","https://scholar.google.com/scholar?cites=15076431005304313975&as_sdt=2005&sciodt=0,5&hl=en",415,"2021-02-09 14:33:32","","","","",,,,,5,2.50,1,4,2,"… the proposed method is capable of ef- fectively protecting the privacy of the users against a state- of-the-art recognition method … faces was validated using both PSNR reconstruction measure, as well as by demonstrating its robustness against automated machine learning attacks …"
1,"Q Cappart, JOR Aoga, P Schaus","Episodesupport: A global constraint for mining frequent patterns in a long sequence of events",2018,"International Conference on the …","Springer","https://link.springer.com/chapter/10.1007/978-3-319-93031-2_7","https://scholar.google.com/scholar?cites=4059110936740254012&as_sdt=2005&sciodt=0,5&hl=en",416,"2021-02-09 14:33:32","","","","",,,,,1,0.33,0,3,3,"… Our experiments on real data sets of different levels of complexity show that the introduced constraints is competitive with the state-of-the-art methods in terms of execution time and memory consumption while offering the flexibility of adding constraints on the patterns. Keywords …"
4,"A Collins, J Beel","A First Analysis of Meta-Learned Per-Instance Algorithm Selection in Scholarly Recommender Systems",2019,"… on Recommendation in Complex Scenarios, 13th …","isg.beel.org","https://isg.beel.org/blog/2019/08/20/meta-learned-per-instance-algorithm-selection-in-scholarly-recommender-systems/","https://scholar.google.com/scholar?cites=16988744077444538238&as_sdt=2005&sciodt=0,5&hl=en",417,"2021-02-09 14:33:32","HTML","","","",,,,,4,2.00,2,2,2,"… For beginners in recommender systems, it is difficult to get an overview of the state-of-the-art, the most relevant venues, and helpful tools and datasets. Similarly, experts in recommender- systems may find it difficult to keep up Read more… Automated Machine Learning (AutoML …"
0,"M Wistuba, A Rawat","Scalable Large Margin Gaussian Process Classification",2019,"Joint European Conference on Machine Learning …","Springer","https://link.springer.com/chapter/10.1007/978-3-030-46147-8_30","",418,"2021-02-09 14:33:32","","","","",,,,,0,0.00,0,2,2,"… to be effective for online classification [18], active learning [29], global optimization of expensive black-box functions [11], automated machine learning [32], and … We compare the proposed LMGP on 68 structured data sets to a state-of-the-art binary Bayesian SVM with the one-vs …"
50,"E Berman","A government of laws and not of machines",2018,"BUL Rev.","HeinOnline","https://heinonline.org/hol-cgi-bin/get_pdf.cgi?handle=hein.journals/bulr98&section=41","https://scholar.google.com/scholar?cites=14316483876017169308&as_sdt=2005&sciodt=0,5&hl=en",419,"2021-02-09 14:33:32","","","","",,,,,50,16.67,50,1,3,"… '43 Finally, however automated machine learning becomes, humans will always play a critical role.44 They will always determine what data is available, which type of algorithm(s) to employ, which features within the data are relevant …"
0,"AP Cuesta","Hyperparameter Optimization for Large-scale Machine Learning",2018,"","researchgate.net","https://www.researchgate.net/profile/Aitor_Palacios_Cuesta/publication/331454415_Hyperparameter_Optimization_for_Large-scale_Machine_Learning/links/5c79b593a6fdcc4715a6e186/Hyperparameter-Optimization-for-Large-scale-Machine-Learning.pdf","",420,"2021-02-09 14:33:32","PDF","","","",,,,,0,0.00,0,1,3,"… possible. More concretely, the goals of this study are: • An analysis of state-of-the-art hyperparameter optimization methods, comparing them and evaluating their characteristics and suitability for large-scale machine learning and data-parallel systems …"
69,"BE Bejnordi, M Mullooly, RM Pfeiffer, S Fan…","Using deep convolutional neural networks to identify and classify tumor-associated stroma in diagnostic breast biopsies",2018,"Modern …","nature.com","https://www.nature.com/articles/s41379-018-0073-z","https://scholar.google.com/scholar?cites=5374110760369104933&as_sdt=2005&sciodt=0,5&hl=en",421,"2021-02-09 14:33:32","","","","",,,,,69,23.00,14,5,3,"… To gain insights into stromal changes associated with breast cancer, we applied automated machine learning techniques to digital images of 2387 hematoxylin and eosin stained tissue sections of benign and malignant image-guided breast biopsies performed to investigate …"
12,"P Benecki, M Kawulok, D Kostrzewa, L Skonieczny","Evaluating super-resolution reconstruction of satellite images",2018,"Acta Astronautica","Elsevier","https://www.sciencedirect.com/science/article/pii/S0094576518300109","https://scholar.google.com/scholar?cites=12740605535843277522&as_sdt=2005&sciodt=0,5&hl=en",422,"2021-02-09 14:33:32","","","","",,,,,12,4.00,3,4,3,"… reconstruct an HR image. However, the effectiveness of the state-of-the-art SRR methods is still insufficient to make them capable of enhancing satellite images captured using conventional imaging sensors. One of the pivotal …"
2,"M Velazquez, R Anantharaman…","RNN-Based Alzheimer's Disease Prediction from Prodromal Stage using Diffusion Tensor Imaging",2019,"… on Bioinformatics and …","ieeexplore.ieee.org","https://ieeexplore.ieee.org/abstract/document/8983391/","https://scholar.google.com/scholar?cites=5133459281766513814&as_sdt=2005&sciodt=0,5&hl=en",423,"2021-02-09 14:33:32","","","","",,,,,2,1.00,1,3,2,"… Our results are state-of-the-art and demonstrate high accuracy in determining which individuals will develop AD within the next … The NASNet architecture was developed in 2017 by Google researchers and represents an automated machine learning structure which gathers and …"
0,"J Macintyre, L Iliadis, I Maglogiannis, C Jayne","Engineering Applications of Neural Networks: 20th International Conference, EANN 2019, Xersonisos, Crete, Greece, May 24-26, 2019, Proceedings",2019,"","books.google.com","https://books.google.com/books?hl=en&lr=&id=JXqYDwAAQBAJ&oi=fnd&pg=PR5&dq=%22automated+machine+learning%22+%22state+of+the+art%22&ots=b2dzsG51-R&sig=ibA07AaCr_X7zmbqGTDdBsdN4gw","",424,"2021-02-09 14:33:32","BOOK","","","",,,,,0,0.00,0,4,2,"… Electronic Health Records: From temporal Abstraction to Timeseries Interpretability” A three-hour tutorial on “Automated Machine Learning for Bioinformatics … 45%) for PEINT 2019, covering most of the aforementioned topics, with contributions beyond the state of the art, both in …"
6,"PK Kudjo, J Chen, M Zhou, S Mensah…","Improving the accuracy of vulnerability report classification using term frequency-inverse gravity moment",2019,"2019 IEEE 19th …","ieeexplore.ieee.org","https://ieeexplore.ieee.org/abstract/document/8854680/","https://scholar.google.com/scholar?cites=617289668886903903&as_sdt=2005&sciodt=0,5&hl=en",425,"2021-02-09 14:33:32","","","","",,,,,6,3.00,1,5,2,"… methods. We chose TF-IDF as the benchmark technique be- cause Cohen [20] advice that we compare new methods against the simplest possible alternative and partly due to the fact that it represents the state-of-the-art technique …"
1,"S Hosseini, H Simianer, J Tetens, B Brenig…","Efficient phenotypic sex classification of zebrafish using machine learning methods",2019,"Ecology and …","Wiley Online Library","https://onlinelibrary.wiley.com/doi/abs/10.1002/ece3.5788","https://scholar.google.com/scholar?cites=16543401671739834339&as_sdt=2005&sciodt=0,5&hl=en",426,"2021-02-09 14:33:32","","","","",,,,,1,0.50,0,5,2,"… Deep learning models, a relatively new branch of machine learning, consist of multiple processing layers to learn representations of large datasets and have dramatically advanced and improved the state‐of‐the‐art in various research fields (LeCun, Bengio, & Hinton, 2015 …"
1,"JD Homburg, M Adams, M Thies, T Korthals…","Constraint exploration of convolutional network architectures with neuroevolution",2019,"… Work-Conference on …","Springer","https://link.springer.com/chapter/10.1007/978-3-030-20518-8_61","https://scholar.google.com/scholar?cites=16722809198067266619&as_sdt=2005&sciodt=0,5&hl=en",427,"2021-02-09 14:33:32","","","","",,,,,1,0.50,0,5,2,"… In comparison, the evolved network structures can compete with state-of-the-art networks considering their size and outperform non-ensemble … 5. Feurer, M., Klein, A., Eggensperger, K., Springenberg, J., Blum, M., Hutter, F.: Efficient and robust automated machine learning …"
3,"M Felder, F Sehnke, K Ohnmeiß…","Probabilistic short term wind power forecasts using deep neural networks with discrete target classes",2018,"Advances in …","adgeo.copernicus.org","https://adgeo.copernicus.org/articles/45/13/2018/","https://scholar.google.com/scholar?cites=5703021300013640293&as_sdt=2005&sciodt=0,5&hl=en",428,"2021-02-09 14:33:32","HTML","","","",,,,,3,1.00,1,4,3,"… helpful. Using state-of-the-art deep learning technology, we applied our method to a large region and a single wind farm. MAE scores of the 50-percentile were on par with or better than comparable deterministic forecasts. The …"
0,"M Hader, B van Stein, S Verberne","Bayesian Optimization for Automatic Configuration of Convolutional Neural Networks for Text Classification",,"theses.liacs.nl","","https://theses.liacs.nl/pdf/2018-2019-HaderMounir.pdf","",429,"2021-02-09 14:33:32","PDF","","","",,,,,0,0.00,0,3,,"… CNNs for binary text classification. To this end, we introduce a simple, configurable model (TXT-CNN) that achieves state-of-the-art performances after (automated) optimization with MiP-EGO. Furthermore, the original MiP-EGO …"
0,"A Kiseleva","What is artificial intelligence and why does it matter for Copyright",2019,"","4ipcouncil.com","https://www.4ipcouncil.com/application/files/6815/4876/6908/What_is_artificial_intelligence_and_why_does_it_matter_for_Copyright.pdf","",430,"2021-02-09 14:33:32","PDF","","","",,,,,0,0.00,0,1,2,"… While machine learning is often described as a sub-discipline of AI, it's better to think of it as the current state-of-the-art – it's the field of AI which today is showing the most promise at providing … For example, “Google's automated machine learning system recently crafted …"
0,"P Singh","Analysis of Efficient Neural Architecture Search via Parameter Sharing",,"core.ac.uk","","https://core.ac.uk/download/pdf/237084797.pdf","",431,"2021-02-09 14:33:32","PDF","","","",,,,,0,0.00,0,1,,"… Neural architecture search can be considered a subset of automated machine learning(AutoML) domain [HKV18]. In this thesis, we have looked at a state of the art neural architecture search tech- nique ""Efficient neural architecture search via parameter sharing""(ENAS) [PGZ+18 …"
2,"A Sartison, D Mironov, K Youcef-Toumi…","Finger grip force estimation from video using two stream approach",2018,"arXiv preprint arXiv …","arxiv.org","https://arxiv.org/abs/1803.01630","https://scholar.google.com/scholar?cites=11063745740500951921&as_sdt=2005&sciodt=0,5&hl=en",432,"2021-02-09 14:33:32","","","","",,,,,2,0.67,1,4,3,"… The position estimation in this approach is well studied [8], [9]. State of the art algorithm [9] uses deep convolutional architecture … [18] M. Feurer, A. Klein, K. Eggensperger, J. Springenberg, M. Blum, and F. Hutter, “Efficient and robust automated machine learning,” in Advances in …"
9,"S Oviatt, K Hang, J Zhou, K Yu, F Chen","Dynamic handwriting signal features predict domain expertise",2018,"ACM Transactions on …","dl.acm.org","https://dl.acm.org/doi/abs/10.1145/3213309","https://scholar.google.com/scholar?cites=11422542190975270464&as_sdt=2005&sciodt=0,5&hl=en",433,"2021-02-09 14:33:32","","","","",,,,,9,3.00,2,5,3,"Page 1. 18 Dynamic Handwriting Signal Features Predict Domain Expertise S. OVIATT, Monash University K. HANG, University of New South Wales J. ZHOU, K. YU, and F. CHEN, DATA61, CSIRO As commercial pen-centric …"
6,"N Moniz, R Ribeiro, V Cerqueira…","Smoteboost for regression: Improving the prediction of extreme values",2018,"2018 IEEE 5th …","ieeexplore.ieee.org","https://ieeexplore.ieee.org/abstract/document/8631400/","https://scholar.google.com/scholar?cites=9198267596128485926&as_sdt=2005&sciodt=0,5&hl=en",434,"2021-02-09 14:33:32","","","","",,,,,6,2.00,2,4,3,"… prediction [9]; 2) an extensive experimental evaluation and analysis of imbalanced regression tasks using 30 datasets to demon- strate the efficacy of the proposed SMOTEBoost variants for regression — including a comparison to other state- of-the-art ensemble approaches …"
23,"S Kim, I Kim, S Lim, W Baek, C Kim, H Cho…","Scalable neural architecture search for 3d medical image segmentation",2019,"… Conference on Medical …","Springer","https://link.springer.com/chapter/10.1007/978-3-030-32248-9_25","https://scholar.google.com/scholar?cites=8625417786546025394&as_sdt=2005&sciodt=0,5&hl=en",435,"2021-02-09 14:33:32","","","","",,,,,23,11.50,3,7,2,"… Currently, the same problem in the field of general deep learning has promoted the rapid development of automated machine learning (AutoML) … Following the idea of micro search space popularly used in the state-of-the-art NAS approaches [6, 10, 16], U-Net-like networks are …"
3,"M Fritz, H Schwarz","Initializing k-means efficiently: Benefits for exploratory cluster analysis",2019,"OTM Confederated International Conferences"" On the …","Springer","https://link.springer.com/chapter/10.1007/978-3-030-33246-4_9","https://scholar.google.com/scholar?cites=5600415710529399026&as_sdt=2005&sciodt=0,5&hl=en",436,"2021-02-09 14:33:32","","","","",,,,,3,1.50,2,2,2,"… can be performed in an automated manner due to the recent advancements in the research area of automated machine learning (AutoML) [8 … 4, we investigate the commonalities of k-Means++ and k-Means\(\Vert \), the current state-of-the-art algorithms for initializing the k-Means …"
1,"JE Dartois, J Boukhobza, V Francoise…","Tracking Application Fingerprint in a Trustless Cloud Environment for Sabotage Detection",2019,"2019 IEEE 27th …","ieeexplore.ieee.org","https://ieeexplore.ieee.org/abstract/document/8843307/","https://scholar.google.com/scholar?cites=17969283884450539658&as_sdt=2005&sciodt=0,5&hl=en",437,"2021-02-09 14:33:32","","","","",,,,,1,0.50,0,4,2,"… as a second level of security that can be coupled with other existing approaches already proposed in the state of the art studies … [18] M. Feurer, A. Klein, K. Eggensperger, J. Springenberg, M. Blum, and F. Hutter, “Efficient and robust automated machine learning,” in Advances in …"
6,"E Kokiopoulou, A Hauth, L Sbaiz, A Gesmundo…","Fast task-aware architecture inference",2019,"arXiv preprint arXiv …","arxiv.org","https://arxiv.org/abs/1902.05781","https://scholar.google.com/scholar?cites=4340071238884235502&as_sdt=2005&sciodt=0,5&hl=en",438,"2021-02-09 14:33:32","","","","",,,,,6,3.00,1,5,2,"… Page 2. man experts can design state-of-the-art models using prior knowledge about how existing architectures perform across different data sets. Similar to human experts, we aim to cross learn from several task data sets and leverage prior knowledge …"
0,"YA Jnr","ARTIFICIAL INTELLIGENCE AND HEALTHCARE: A QUALITATIVE REVIEW OF RECENT ADVANCES AND PREDICTIONS FOR THE FUTURE.",2019,"","pimr.org.in","https://www.pimr.org.in/2019-vol7-issue-3/YawAnsongJnr_v3.pdf","",439,"2021-02-09 14:33:32","PDF","","","",,,,,0,0.00,0,1,2,"… For instance, Katherine Torres and her colleagues developed an automated machine-learning algorithm for malaria detection … Page 4. 2. Ben Goertzel. Artificial General Intelligence: Concept, State of the Art, and Future Prospects …"
0,"CN Sánchez, M Graff","Selection Heuristics on Semantic Genetic Programming for Classification Problems",2019,"arXiv preprint arXiv:1907.07066","arxiv.org","https://arxiv.org/abs/1907.07066","",440,"2021-02-09 14:33:32","","","","",,,,,0,0.00,0,2,2,"… Furthermore, in comparison with state-of-the-art classifiers, our GP system obtained the second-lowest rank being the first one TPOT, although the difference in performance between these systems, in … (2015) developed a robust automated machine learning (AutoML) technique …"
0,"ID Place Sr No","FIFTH INTERNATIONAL CONFERENCE FOR CONVERGENCE OF TECHNOLOGY (I2CT 2019)",,"ieeexplore.ieee.org","","https://ieeexplore.ieee.org/abstract/document/9033529/","",441,"2021-02-09 14:33:32","CITATION","","","",,,,,0,0.00,0,1,,"… Nawab Yousuf Ali and Omor FaruN RaNib An automated machine learning approach for sentiment classification of Bengali EYCommerce Sites … 7 409 Bhushan ThaNare and Rashmi Patil Machine Translation System : The State of the Art Survey and Challenges …"
6,"RL Castro, C Schmitt, G Dreo","Aimed: Evolving malware with genetic programming to evade detection",2019,"2019 18th IEEE International …","ieeexplore.ieee.org","https://ieeexplore.ieee.org/abstract/document/8887384/","https://scholar.google.com/scholar?cites=11396332063096528803&as_sdt=2005&sciodt=0,5&hl=en",442,"2021-02-09 14:33:32","","","","",,,,,6,3.00,2,3,2,"… Therefore, we aim to provide evidence that motivated adversaries can use GP to be able to bypass state- of-the-art malware detection … Combining that approach with computer programs brings us GP, which is an approach to automated machine learning that attempts to evolve …"
1,"A Pakrashi, B Mac Namee","CascadeML: An Automatic Neural Network Architecture Evolution and Training Algorithm for Multi-label Classification (Best Technical Paper)",2019,"… on Innovative Techniques and Applications of …","Springer","https://link.springer.com/chapter/10.1007/978-3-030-34885-4_1","https://scholar.google.com/scholar?cites=18129154521479784646&as_sdt=2005&sciodt=0,5&hl=en",443,"2021-02-09 14:33:32","","","","",,,,,1,0.50,1,2,2,"… CascadeML is the first automatic neural network algorithm with a competitive performance to hyperparameter tuned state-of-the-art multi-label … 7. Feurer, M., Klein, A., Eggensperger, K., Springenberg, J., Blum, M., Hutter, F.: Efficient and robust automated machine learning …"
34,"M Zhang, S Jiang, Z Cui, R Garnett, Y Chen","D-vae: A variational autoencoder for directed acyclic graphs",2019,"arXiv preprint arXiv …","arxiv.org","https://arxiv.org/abs/1904.11088","https://scholar.google.com/scholar?cites=12885597260729111946&as_sdt=2005&sciodt=0,5&hl=en",444,"2021-02-09 14:33:32","","","","",,,,,34,17.00,7,5,2,"… Secondly, state-of-the-art black-box optimization techniques such as simulated annealing and Bayesian optimization primarily operate in a continuous space, thus are not directly applicable to DAG optimization due to the discrete nature of DAGs …"
2,"C Toher, C Oses, S Curtarolo","Automated computation of materials properties",2019,"Materials Informatics: Methods …","Wiley Online Library","https://onlinelibrary.wiley.com/doi/abs/10.1002/9783527802265.ch7","https://scholar.google.com/scholar?cites=6557813558803885177&as_sdt=2005&sciodt=0,5&hl=en",445,"2021-02-09 14:33:32","","","","",,,,,2,1.00,1,3,2,"… Open Database (TCOD) [24]. For this data to be consumable by automated machine learning algorithms, it must be organized in program- matically accessible repositories [4, 5, 7, 11, 12, 15, 23]. These frameworks also contain …"
5,"JS Angarita-Zapata, I Triguero…","A preliminary study on automatic algorithm selection for short-term traffic forecasting",2018,"… Symposium on Intelligent …","Springer","https://link.springer.com/chapter/10.1007/978-3-319-99626-4_18","https://scholar.google.com/scholar?cites=2615708197908444660&as_sdt=2005&sciodt=0,5&hl=en",446,"2021-02-09 14:33:32","","","","",,,,,5,1.67,2,3,3,"… Concretely, we compare Auto-WEKA with four state-of-the-art ML algorithms (NN, SVM, k-NN and RF) in the task of forecasting traffic Level of … 1. Feurer, M., Klein, A., Eggensperger, K., Springenberg, J., Blum, M., Hutter, F.: Efficient and robust automated machine learning. Adv …"
8,"JJE Conway","Artificial intelligence and machine learning: current applications in real estate",2018,"","dspace.mit.edu","https://dspace.mit.edu/handle/1721.1/120609","https://scholar.google.com/scholar?cites=1349773082952779956&as_sdt=2005&sciodt=0,5&hl=en",447,"2021-02-09 14:33:32","","","","",,,,,8,2.67,8,1,3,"Page 1. Artificial Intelligence and Machine Learning: Current Applications in Real Estate by Jennifer Conway BA Architecture, 2010 University of California, Berkeley Submitted to the Program in Real Estate Development in Conjunction …"
0,"M Wistuba","Automated Machine Learning-Bayesian Optimization, Meta-Learning & Applications",2018,"","hildok.bsz-bw.de","https://hildok.bsz-bw.de/frontdoor/index/index/docId/809","",448,"2021-02-09 14:33:32","","","","",,,,,0,0.00,0,1,3,"… We compare our approach Automatic Frankensteining with the current state of the art for automated machine learning on  different data sets and can show that it outperforms them on the majority using the same training time …"
2,"MJ Smith, K Lu, K Veeramachaneni","Ballet: A lightweight framework for open-source, collaborative feature engineering",2018,"Machine Learning Systems …","learningsys.org","http://learningsys.org/nips18/assets/papers/15CameraReadySubmissionneurips_sysml_2018-8.pdf","https://scholar.google.com/scholar?cites=13767928339600716641&as_sdt=2005&sciodt=0,5&hl=en",449,"2021-02-09 14:33:32","PDF","","","",,,,,2,0.67,1,3,3,"… The resulting feature matrix can be used as the input to an automated machine learning model or a custom algorithm … While these have led to state-of-the-art modeling performance, there is no natural way for competitors to integrate source code components in a systematic way …"
0,"S Mukhopadhyay, SS Iyengar, AM Madni…","The Next Generation of Artificial Intelligence: Synthesizable AI",2018,"Proceedings of the …","Springer","https://link.springer.com/chapter/10.1007/978-3-030-02686-8_50","",450,"2021-02-09 14:33:32","","","","",,,,,0,0.00,0,4,3,"… 4). Open image in new window Fig. 4. Fig. 4. Gaps in current state-of-the-art intelligent systems … 7. Fig. 7. Using automated diagnostics to prolong the life of industrial machinery. 4.1 Automated Machine Learning System Now Used by NASA. For terrain recognition (Figs …"
0,"N Heller, D Anderson, M Baker, B Juffer…","Convolutional Neural Networks for Aircraft Noise Monitoring",2018,"arXiv preprint arXiv …","arxiv.org","https://arxiv.org/abs/1806.04779","",451,"2021-02-09 14:33:32","","","","",,,,,0,0.00,0,5,3,"… In this work, we present an automated machine-learning based method for classifying the noise events using the one-second LAeq of 1/3 … In particular, Convolutional Neural Networks (CNNs) have surpassed the previous state of the art results for nearly every task in the field of …"
16,"M Leclercq, B Vittrant, ML Martin-Magniette…","Large-scale automatic feature selection for biomarker discovery in high-dimensional OMICs data",2019,"Frontiers in …","frontiersin.org","https://www.frontiersin.org/articles/10.3389/fgene.2019.00452/full","https://scholar.google.com/scholar?cites=5089555743345216546&as_sdt=2005&sciodt=0,5&hl=en",452,"2021-02-09 14:33:32","HTML","","","",,,,,16,8.00,4,4,2,"… In all cases, BioDiscML outperform these state-of-the-art tools. BioDiscML vs. Mint. MINT implements a multivariate integrative method able to integrate independent datasets, reduce batch effect, classify instances and identify key discriminant variables …"
7,"S Servan-Schreiber, M Riondato…","ProSecCo: Progressive sequence mining with convergence guarantees",2019,"Knowledge and Information …","Springer","https://link.springer.com/content/pdf/10.1007/s10115-019-01393-8.pdf","https://scholar.google.com/scholar?cites=7480130651146250302&as_sdt=2005&sciodt=0,5&hl=en",453,"2021-02-09 14:33:32","","","","",,,,,7,3.50,2,3,2,"… results almost immediately. Its practical performance is even better than what is guaranteed by the theoretical analysis, and ProSecCo can even be faster than existing state-of-the-art non-progressive algorithms. Additionally, our …"
