Cites,Authors,Title,Year,Source,Publisher,ArticleURL,CitesURL,GSRank,QueryDate,Type,DOI,ISSN,CitationURL,Volume,Issue,StartPage,EndPage,ECC,CitesPerYear,CitesPerAuthor,AuthorCount,Age,Abstract
0,"A Kar, PK Biswas","Fast Bayesian Uncertainty Estimation of Batch Normalized Single Image Super-Resolution Network",2019,"arXiv preprint arXiv:1903.09410","arxiv.org","https://arxiv.org/abs/1903.09410","",582,"2021-02-09 14:33:32","","","","",,,,,0,0.00,0,2,2,"… Due to the ad- vancement of deep learning techniques, the community has developed a state-of-the-art SISR network using deep … perceptual qual- ity of images for human interpretation, SISR helps to boost the performance of different automated machine learning or computer …"
1,"J Eskonen","Deep Reinforcement Learning in Automated User Interface Testing",2019,"","aaltodoc.aalto.fi","https://aaltodoc.aalto.fi/handle/123456789/37895","https://scholar.google.com/scholar?cites=1582980240704661667&as_sdt=2005&sciodt=0,5&hl=en",583,"2021-02-09 14:33:32","","","","",,,,,1,0.50,1,1,2,"… and recurrent neural networks (RNNs). The A3C implementation shows fast training. It learns many Atari games in under 30 minutes and achieves state of the art results for some games. More details about the implementation …"
0,"A Salama, A Linke, IP Rocha, C Binnig","XAI: A Middleware for Scalable AI.",2019,"DATA","scitepress.org","https://www.scitepress.org/Papers/2019/81203/81203.pdf","",584,"2021-02-09 14:33:32","PDF","","","",,,,,0,0.00,0,4,2,"… DNN in the next itera- tion. In XAI, we currently implement a state-of- the art approach based on selecting hyper-parameters (Eggensperger et al., 2013), which is also available in Auto-sklearn. This approach uses a random-forest …"
37,"S Hertz, M Olof-Ors, E Weinreb, O Hazai…","Machine learning-based relationship association and related discovery and search engines",2019,"US Patent …","Google Patents","https://patents.google.com/patent/US10303999B2/en","https://scholar.google.com/scholar?cites=4514402529631917318&as_sdt=2005&sciodt=0,5&hl=en",585,"2021-02-09 14:33:32","","","","",,,,,37,18.50,7,5,2,"US10303999B2 - Machine learning-based relationship association and related discovery and search engines - Google Patents. Machine learning-based relationship association and related discovery and search engines. Download PDF Info …"
0,"G Mai, R Gou, L Ji, H Wu, F Cao…","LeapDetect: An Agile Platform for Inspecting Power Transmission Lines from Drones",2019,"… Conference on Data …","ieeexplore.ieee.org","https://ieeexplore.ieee.org/abstract/document/8955629/","",586,"2021-02-09 14:33:32","","","","",,,,,0,0.00,0,6,2,"… Faster R-CNN [9], a state-of-the-art detection algorithm, trained with the default configurations and … Hugo, G. Isabelle, H. Yi-Qi, L. Yu- Feng, T. Wei-Wei, Y. Qiang, and Y. Yang, “Taking human out of learning applications: A survey on automated machine learning,” arXiv preprint …"
0,"BC Ooi, G Chen, Q Lin, KY Ngiam, S Wang, W Wang…","Distributed Deep Learning for Broadly Deployed Health Care",,"comp.nus.edu.sg","","https://www.comp.nus.edu.sg/~ooibc/healthcare2019.pdf","",587,"2021-02-09 14:33:32","PDF","","","",,,,,0,0.00,0,7,,"… IV. CURRENT STATE OF THE ART In this section, we introduce the state-of-the-art solutions towards the challenges mentioned in Section III … To ease the burden on AI users, the concept of AutoML (automated machine learning) has been suggested …"
1,"U Khurana","Automating feature engineering in supervised learning",2018,"Feature Engineering for Machine Learning and …","udayankhurana.com","https://udayankhurana.com/wp-content/uploads/2018/07/FEbook-Chapter9.pdf","https://scholar.google.com/scholar?cites=5421844164990629839&as_sdt=2005&sciodt=0,5&hl=en",588,"2021-02-09 14:33:32","PDF","","","",,,,,1,0.33,1,1,3,"Page 1. Chapter 9 Automating Feature Engineering in Supervised Learning Udayan Khurana IBM Research 9.1 Introduction ..... 116 9.1.1 Challenges in Performing Feature Engineering ..... 117 …"
0,"D Bányay","MLSurf: Surfer Motion Characterization Using Machine Learning Techniques",2019,"","diva-portal.org","https://www.diva-portal.org/smash/record.jsf?pid=diva2:1375911","",589,"2021-02-09 14:33:32","","","","",,,,,0,0.00,0,1,2,"… Chapter 2 Background 2.1 State of the art As mentioned in the Introduction, the need for action sports trackers is con- stantly increasing … The location can be shared by pushing an emergency button on the vest as well. Novelty compared to other state-of-the-art applications …"
5,"Y Chu, C Luo, S Cai, H You","Empirical investigation of stochastic local search for maximum satisfiability",2019,"Frontiers of Computer Science","Springer","https://link.springer.com/content/pdf/10.1007/s11704-018-7107-z.pdf","https://scholar.google.com/scholar?cites=6173835086847929446&as_sdt=2005&sciodt=0,5&hl=en",590,"2021-02-09 14:33:32","","","","",,,,,5,2.50,1,4,2,"… Exper- imental results show that our enhanced algorithm performs better than its state-of-the-art SLS competitors on a large number of industrial MAX-SAT instances … Evaluated version: We adopt CCLS as the state-of-the- art SLS competitor in the related experiments …"
2,"C Wang, Q Wu","Flo: Fast and lightweight hyperparameter optimization for automl",2019,"arXiv preprint arXiv:1911.04706","arxiv.org","https://arxiv.org/abs/1911.04706","https://scholar.google.com/scholar?cites=4999837840957987933&as_sdt=2005&sciodt=0,5&hl=en",591,"2021-02-09 14:33:32","","","","",,,,,2,1.00,1,2,2,"… Hyperparameter opti- mization is a core component for building Automated Machine Learning (AutoML) software … For example, using a recent large-scale AutoML bench- mark [GLT+19], the state-of-the-art solutions underperform a tuned random forest baseline on 40-50% tasks …"
3,"MJ Meister","Maggy: open-source asynchronous distributed hyperparameter optimization based on Apache Spark",2019,"","politesi.polimi.it","https://www.politesi.polimi.it/handle/10589/149859","https://scholar.google.com/scholar?cites=7028228652647209861&as_sdt=2005&sciodt=0,5&hl=en",592,"2021-02-09 14:33:32","","","","",,,,,3,1.50,3,1,2,"… Firstly, there is a section defining the more general concept of automated machine learning (Auto-ML) and some terms and concepts … in machine learning pipelines are investigated and is fol- lowed by a introduction of hyperparameter optimization and its current state-of-the-art …"
0,"A KOAR","Journal of Information Science Theory and Practice",2019,"","repository.kisti.re.kr","https://repository.kisti.re.kr/bitstream/10580/15301/2/2019%20JISTaP%207%283%29.pdf","",593,"2021-02-09 14:33:32","PDF","","","",,,,,0,0.00,0,1,2,"… A summary of state-of the- art techniques on learning analytics and educational data mining takes place in the study of Steiner, Kickmeier-Rust, and Albert (2014) which has focused on key concepts, objectives, data, and the analytics methods which are used also for …"
0,"F Zhang, X Fan, H Xu, P Zhou, Y He, J Liu","Dynamic Connected Neural Decision Classifier and Regressor with Dynamic Softing Pruning",2019,"arXiv preprint arXiv …","arxiv.org","https://arxiv.org/abs/1911.05443","",594,"2021-02-09 14:33:32","","","","",,,,,0,0.00,0,6,2,"… In this section, we empirically evaluate the performance of the proposed DNSPN. Several state-of-the-art methods are adopted as the baselines, including Decision Tree (DT) [14], AutoSkearn[5], SVM[17], and the Deep feedforward Fully Connected neural network (DFC) [18] …"
14,"J Chen, W Hu, L Zhang, D Hao…","Learning to accelerate symbolic execution via code transformation",2018,"… Conference on Object …","drops.dagstuhl.de","https://drops.dagstuhl.de/opus/volltexte/2018/9211/","https://scholar.google.com/scholar?cites=5556429284558022650&as_sdt=2005&sciodt=0,5&hl=en",595,"2021-02-09 14:33:32","","","","",,,,,14,4.67,3,5,3,"Page 1. Learning to Accelerate Symbolic Execution via Code Transformation Junjie Chen Key Laboratory of High Confidence Software Technologies (Peking University), MoE Institute of Software, EECS, Peking University, Beijing, 100871, China chenjunjie@pku.edu.cn …"
6,"D Reker, G Bernardes, T Rodrigues","Evolving and nano data enabled machine intelligence for chemical reaction optimization",2018,"","chemrxiv.org","https://chemrxiv.org/ndownloader/files/13469303","https://scholar.google.com/scholar?cites=10122912688900771918&as_sdt=2005&sciodt=0,5&hl=en",596,"2021-02-09 14:33:32","PDF","","","",,,,,6,2.00,2,3,3,"… These operational features provide substantial improvements over the current state-of-the-art … These results support that optimizing reaction conditions' is a pattern recognition problem accessible to an automated machine learning platform and that true chemical knowledge may …"
1,"TN Do, MT Tran-Nguyen","Automatic hyper-parameters tuning for local support vector machines",2018,"International Conference on Future Data and …","Springer","https://link.springer.com/chapter/10.1007/978-3-030-03192-3_14","https://scholar.google.com/scholar?cites=6174761082843644751&as_sdt=2005&sciodt=0,5&hl=en",597,"2021-02-09 14:33:32","","","","",,,,,1,0.33,1,2,3,"… Download conference paper PDF. 1 Introduction. Support vector machines (SVM) proposed by Vapnik [1] is a state-of-the-art classification technique applied to many pattern recognition problems. Successful applications of SVMs …"
3,"R Mantovani","Use of meta-learning for hyperparameter tuning of classification problems",2018,"","pdfs.semanticscholar.org","https://pdfs.semanticscholar.org/beea/1c429189abe7b99f8bb0284ff709fe645695.pdf","https://scholar.google.com/scholar?cites=1306014031351073450&as_sdt=2005&sciodt=0,5&hl=en",598,"2021-02-09 14:33:32","PDF","","","",,,,,3,1.00,3,1,3,"… AUC Area Under the ROC curve AutoML Automated Machine Learning CASH Combined Algorithm Selection and Hyperparameter Optimization CD Critical Difference … tools and functionalities to ML experts to advance the state-of-the-art in the area. It includes many …"
6,"Q Yao, J Xu, WW Tu, Z Zhu","Differentiable neural architecture search via proximal iterations",2019,"arXiv preprint arXiv:1905.13577","researchgate.net","https://www.researchgate.net/profile/Quanming_Yao/publication/333564485_Efficient_Neural_Architecture_Search_via_Proximal_Iterations/links/5cf51fd44585153c3daf56f5/Efficient-Neural-Architecture-Search-via-Proximal-Iterations.pdf","https://scholar.google.com/scholar?cites=5955575284877000909&as_sdt=2005&sciodt=0,5&hl=en",599,"2021-02-09 14:33:32","PDF","","","",,,,,6,3.00,2,4,2,"… Table 1: Comparison of the proposed NASP with other state-of-the-art NAS methods on four perspectives of searching: differentiable (denoted as “diff”), cell, complete, and constraint … Table 2: Classification errors of NASP and state-of-the-art image classifiers on CIFAR-10 …"
29,"W Zhao, J Yang, B Ni, D Bi, Y Sun, M Xu…","Toward automatic prediction of EGFR mutation status in pulmonary adenocarcinoma with 3D deep learning",2019,"Cancer …","Wiley Online Library","https://onlinelibrary.wiley.com/doi/abs/10.1002/cam4.2233","https://scholar.google.com/scholar?cites=17660506371446544240&as_sdt=2005&sciodt=0,5&hl=en",600,"2021-02-09 14:33:32","","","","",,,,,29,14.50,4,7,2,"Abstract To develop a deep learning system based on 3D convolutional neural networks (CNNs), and to automatically predict EGFR‐mutant pulmonary adenocarcinoma in CT images. A dataset of 579 nodules..."
0,"P Vidnerová, J Kalina, Y Güney","A Comparison of Robust Model Choice Criteria Within a Metalearning Study",2019,"Workshop on Analytical Methods in …","Springer","https://link.springer.com/chapter/10.1007/978-3-030-48814-7_7","",601,"2021-02-09 14:33:32","","","","",,,,,0,0.00,0,3,2,"… to Data Mining. Springer, Berlin (2009)CrossRefGoogle Scholar. 4. Brazdil, P., Giraud-Carrier, C.: Metalearning and algorithm selection: progress, state of the art and introduction to the 2018 special issue. Mach. Learn. 107, 1 …"
0,"D Bouneffouf","Online Sparse Coding with Bandit Feedback",2019,"","hal.archives-ouvertes.fr","https://hal.archives-ouvertes.fr/hal-03008615/","",602,"2021-02-09 14:33:32","","","","",,,,,0,0.00,0,1,2,"… [17] Djallel Bouneffouf. DRARS, a dynamic risk-aware recommender system. PhD thesis, 2013. [18] Djallel Bouneffouf. Evolution of the user's content: An overview of the state of the art. arXiv preprint arXiv:1305.1787, 2013. [19] Djallel Bouneffouf …"
0,"E Dufourq","Evolutionary deep learning",2019,"","open.uct.ac.za","https://open.uct.ac.za/handle/11427/30357","",603,"2021-02-09 14:33:32","","","","",,,,,0,0.00,0,1,2,"… necessary to address these areas which have not previously been researched. The focus was not to investigate on how to create new state-of-the-art ap- proaches, but rather to evaluate and investigate novel approaches. We for- mulate the following six objectives for this thesis …"
0,"KM Sowinska, P Madhyastha","Multi-View Learning Approaches for Stock Return Prediction with Tweets",2019,"","imperial.ac.uk","https://www.imperial.ac.uk/media/imperial-college/faculty-of-engineering/computing/public/1819-pg-projects/Multi-View-Learning-Approaches-for-Stock-Return-Prediction-with-Tweets.pdf","",604,"2021-02-09 14:33:32","PDF","","","",,,,,0,0.00,0,2,2,"… London. From helping me to formulate the hypothesis, through directing me towards the state-of-the-art Natural … decomposition. Using auto-sklearn, which is an award-winning automated machine learning library, we achieve 67 …"
0,"A Solar-Lezama","CLIO: A Digital Code Assistant for the Big Code Era",2019,"","apps.dtic.mil","https://apps.dtic.mil/sti/citations/AD1069460","",605,"2021-02-09 14:33:32","","","","",,,,,0,0.00,0,1,2,"… of 69 real-world defects drawn from eight open-source projects, Prophet significantly outperforms the previous state-of-the-art patch generation … work, we compared it to Autosklearn and Tree-Based Pipeline Optimization Tool (TPOT), two automated Machine Learning (ML) tools …"
0,"B Pal, S Khaiyum","Low Memory Footprint CNN Models for end-to-end Driving of Autonomous Ground Vehicle and Custom Adaptation to Various Road Conditions.",,"researchgate.net","","https://www.researchgate.net/profile/Bishwajit_Pal3/publication/340646166_Low_Memory_Footprint_CNN_Models_for_end-to-end_Driving_of_Autonomous_Ground_Vehicle_and_Custom_Adaptation_to_Various_Road_Conditions/links/5e96bf89299bf130799ad81b/Low-Memory-Footprint-CNN-Models-for-end-to-end-Driving-of-Autonomous-Ground-Vehicle-and-Custom-Adaptation-to-Various-Road-Conditions.pdf","",606,"2021-02-09 14:33:32","PDF","","","",,,,,0,0.00,0,2,,"… CNN is widely used for playing games [20], [21], automated machine learning [35], video-to-video synthesis [32] … 17 Ravankar A., Ravankar AA, Kobayashi Y., Hoshino Y., Peng C.-C. Path Smoothing Techniques in Robot Navigation: State-of-the-Art, Current and Future …"
0,"D Montesi, F Bertini, D Allevi","Speech Analysis for Automatic Identification of Mild Cognitive Impairment through Autoencoders",,"core.ac.uk","","https://core.ac.uk/download/pdf/294761012.pdf","",607,"2021-02-09 14:33:32","PDF","","","",,,,,0,0.00,0,3,,"… [1] Page 18. 18 State of the art Below are the results obtained with automatic extraction both with the basic and extended feature set … [2] it has been tried an automated machine learning method, using Deep Neural Network Architectures, that aims to identify MCI. Participants for …"
3,"N Sai","Generation and use of trained file classifiers for malware detection",2018,"US Patent 10,062,038","Google Patents","https://patents.google.com/patent/US10062038B1/en","https://scholar.google.com/scholar?cites=8303020071875333353&as_sdt=2005&sciodt=0,5&hl=en",608,"2021-02-09 14:33:32","","","","",,,,,3,1.00,3,1,3,"US10062038B1 - Generation and use of trained file classifiers for malware detection - Google Patents. Generation and use of trained file classifiers for malware detection. Download PDF Info. Publication number US10062038B1 …"
0,"GB Abbate","Defining the path to implement predictive maintenance on an offshore drilling business",2019,"","repositum.tuwien.at","https://repositum.tuwien.at/handle/20.500.12708/6477","",609,"2021-02-09 14:33:32","","","","",,,,,0,0.00,0,1,2,"Page 1. ģ | (3) ま DD T (CENTER W// GGGGaGGGG GL GGLGGGS Professjona| MEA SM Mttttt Entrepreneurship & Innovation 鸥 AAAAAS LLaLSGGGGG Defining the path to implement predictive maintenance on an offshore …"
17,"S Oviatt, J Grafsgaard, L Chen, X Ochoa","Multimodal learning analytics: Assessing learners' mental state during the process of learning",2018,"The Handbook of Multimodal …","dl.acm.org","https://dl.acm.org/doi/abs/10.1145/3107990.3108003","https://scholar.google.com/scholar?cites=4069397563620849831&as_sdt=2005&sciodt=0,5&hl=en",610,"2021-02-09 14:33:32","","","","",,,,,17,5.67,4,4,3,"Page 1. 11Multimodal Learning Analytics: Assessing Learners' Mental State During the Process of Learning Sharon Oviatt, Joseph Grafsgaard, Lei Chen, Xavier Ochoa 11.1 Introduction Today, new technologies are making …"
19,"J Del Ser, E Osaba…","Bioinspired computational intelligence and transportation systems: a long road ahead",2019,"IEEE Transactions on …","ieeexplore.ieee.org","https://ieeexplore.ieee.org/abstract/document/8661647/","https://scholar.google.com/scholar?cites=3833000970112291254&as_sdt=2005&sciodt=0,5&hl=en",611,"2021-02-09 14:33:32","","","","",,,,,19,9.50,6,3,2,"… algorithms and methods. This paper comprehensively reviews the state-of-the-art around the application of bioinspired methods to the challenges arising in the broad field of intelligent transportation system (ITS). This systematic …"
3,"P Zaphiris, A Ioannou","Learning and Collaboration Technologies. Learning and Teaching: 5th International Conference, LCT 2018, Held as Part of HCI International 2018, Las …",2018,"","books.google.com","https://books.google.com/books?hl=en&lr=&id=9GNjDwAAQBAJ&oi=fnd&pg=PP6&dq=%22automated+machine+learning%22+%22state+of+the+art%22&ots=QMxd7juLi5&sig=UVyK5CK7_KKbXvFyN6LetwZl1q4","https://scholar.google.com/scholar?cites=6678119027765149963&as_sdt=2005&sciodt=0,5&hl=en",612,"2021-02-09 14:33:32","BOOK","","","",,,,,3,1.00,2,2,3,"… This paper is organized as follows; the state of the art engagement in digital education is presented in Sect. 2. Section 3 presents our approach to capture and measure student engagement. The pilot study we carried out and the obtained results are presented in Sect …"
0,"P Perner","Machine Learning and Data Mining in Pattern Recognition: 14th International Conference, MLDM 2018, New York, NY, USA, July 15-19, 2018, Proceedings …",2018,"","books.google.com","https://books.google.com/books?hl=en&lr=&id=CmRjDwAAQBAJ&oi=fnd&pg=PP6&dq=%22automated+machine+learning%22+%22state+of+the+art%22&ots=mjOtB7Fwfm&sig=DmNwrsXTqUWcKQDyMlCTNHt_yCA","",613,"2021-02-09 14:33:32","BOOK","","","",,,,,0,0.00,0,1,3,"… 365 Meenu Ajith and Aswathy Rajendra Kurup Automated Machine Learning Algorithm Mining for Classification Problem . . . 380 Meng-Sung Wu and Jun-Yi Lu Enhancing Outlier Detection by an Outlier Indicator …"
0,"RG Mantovani, ALD Rossi, E Alcobaça, J Vanschoren…","A meta-learning recommender system for hyperparameter tuning",,"pure.tue.nl","","https://pure.tue.nl/ws/files/129167775/1906.01684.pdf","",614,"2021-02-09 14:33:32","PDF","","","",,,,,0,0.00,0,5,,"… Many optimization techniques have been proposed in the literature for this problem, varying from a simple Grid Search (GS) to the state of the art Sequential Model-based … The proposed recommender system can also be categorized as an Automated Machine Learning (Au …"
28,"A Kamath, R Das","A survey on semantic parsing",2018,"arXiv preprint arXiv:1812.00978","arxiv.org","https://arxiv.org/abs/1812.00978","https://scholar.google.com/scholar?cites=6816654881321913235&as_sdt=2005&sciodt=0,5&hl=en",615,"2021-02-09 14:33:32","","","","",,,,,28,9.33,14,2,3,"… This motivation is also in spirit with the emerging research area of automated machine learning (AutoML) [Feurer et al., 2015]. 2.2 Grammar … [2013] explicitly model semantic parsing as a MT task and achieve results comparable to the state of the art on GeoQuery at the time …"
0,"A Riquelme Cencerrado","Smart Glasses: a new way to interact within the world",,"ddd.uab.cat","","https://ddd.uab.cat/record/203356","",616,"2021-02-09 14:33:32","","","","",,,,,0,0.00,0,1,,"… 2 STATE OF THE ART After Google presented the Google Glasses in 2013, the market of the Smart Glasses grew up with a lot of … It consists on the implementation of an automated machine learning system to detect traffic signals in order to display those signals in the screen …"
0,"L Sun-Hosoya, I Guyon, M Sebag","ActivMetaL: Algorithm Recommendation",,"Workshop on Interactive Adaptive Learning","ceur-ws.org","http://ceur-ws.org/Vol-2192/ialatecml_paper3.pdf","",617,"2021-02-09 14:33:32","PDF","","","",,,,,0,0.00,0,3,,"… 2 State of the art It … In: NIPS workshop on Bayesian Optimization in Theory and Practice (2013) 5. Feurer, M., Klein, A., Eggensperger, K., Springenberg, J., Blum, M., Hutter, F.: Efficient and robust automated machine learning. In …"
0,"HE Hockett, KA Rafferty, JC Riordan…","Debug session tree recorder with generic playback",2019,"US Patent …","Google Patents","https://patents.google.com/patent/US10204030B1/en","",618,"2021-02-09 14:33:32","","","","",,,,,0,0.00,0,4,2,"… 4. Developer and/or automated machine learning system (algorithm) captures and parses log lines or other output and converts the data into important pieces, such as metadata and regular expressions (regex), to store both the original data and a generic metadata-based …"
0,"S Bandyopadhyay, A Ukil, P Chetanya…","Method and system for pattern recognition in a signal using morphology aware symbolic representation",2019,"US Patent App. 16 …","Google Patents","https://patents.google.com/patent/US20190278971A1/en","",619,"2021-02-09 14:33:32","","","","",,,,,0,0.00,0,4,2,"US20190278971A1 - Method and system for pattern recognition in a signal using morphology aware symbolic representation - Google Patents. Method and system for pattern recognition in a signal using morphology aware symbolic representation. Download PDF Info …"
20,"O Mirzaei, JM de Fuentes, J Tapiador…","AndrODet: An adaptive Android obfuscation detector",2019,"Future Generation …","Elsevier","https://www.sciencedirect.com/science/article/pii/S0167739X18309312","https://scholar.google.com/scholar?cites=7247877398094467939&as_sdt=2005&sciodt=0,5&hl=en",620,"2021-02-09 14:33:32","HTML","","","",,,,,20,10.00,5,4,2,"… We have also compared our results with state-of-the-art batch learning algorithms by leveraging Auto Tune Models (ATM) [12], a system developed for hyper-parameter tuning of batch learning algorithms and classification using a variety of algorithms from this kind …"
1,"P Probst","Hyperparameters, tuning and meta-learning for random forest and other machine learning algorithms",2019,"","edoc.ub.uni-muenchen.de","https://edoc.ub.uni-muenchen.de/24557/","https://scholar.google.com/scholar?cites=9051849432458665996&as_sdt=2005&sciodt=0,5&hl=en",621,"2021-02-09 14:33:32","","","","",,,,,1,0.50,1,1,2,"… The concepts of automated machine learning and meta-learning are presented in more detail as they are not well known in the community and play an important role in most of the topics discussed in this dissertation. 1.1 Simple Statistics for Summarizing …"
0,"MF Lospinuso, S Harshavardhana…","Apparatus and Method for Identifying Constituent Parts of Software Binaries",2019,"US Patent App. 16 …","Google Patents","https://patents.google.com/patent/US20190250911A1/en","",622,"2021-02-09 14:33:32","","","","",,,,,0,0.00,0,3,2,"… As indicated above, a technical problem exists in the current state of the art in that automated software analysis techniques are limited to analyzing compiled, executable software at the software binary level (ie, the binary file as a whole) …"
0,"K Siren","Multi-omics Methods to unravel Microbial Diversity in Fermentation of Riesling Wines",2019,"","kluedo.ub.uni-kl.de","https://kluedo.ub.uni-kl.de/frontdoor/index/index/docId/5596","",623,"2021-02-09 14:33:32","","","","",,,,,0,0.00,0,1,2,"Page 1. Multi-omics Methods to unravel Microbial Diversity in Fermentation of Riesling Wines Vom Fachbereich Chemie der Technischen Universität Kaiserslautern zur Verleihung des akademischen Grades “Doktor der Naturwissenschaften” genehmigte Dissertation …"
23,"Y Yuan, G Xun, Q Suo, K Jia, A Zhang","Wave2vec: Deep representation learning for clinical temporal data",2019,"Neurocomputing","Elsevier","https://www.sciencedirect.com/science/article/pii/S092523121830626X","https://scholar.google.com/scholar?cites=16496494512394951477&as_sdt=2005&sciodt=0,5&hl=en",624,"2021-02-09 14:33:32","","","","",,,,,23,11.50,5,5,2,"… We demonstrate that the proposed Wave2Vec model achieves better performance compared to the state-of-the-art feature learning methods on two real-world … This has motivated researchers to design automated machine learning approaches for several clinical tasks [18], [19] …"
63,"D Steiner, J Day","System and method for real-time detection of anomalies in database usage",2019,"US Patent 10,409,665","Google Patents","https://patents.google.com/patent/US10409665B2/en","https://scholar.google.com/scholar?cites=1710419679475581764&as_sdt=2005&sciodt=0,5&hl=en",625,"2021-02-09 14:33:32","","","","",,,,,63,31.50,32,2,2,"… Embodiments address the above problems and improves the state of the art by providing an automated mechanism to continuously monitor ALL … A key inventive feature of embodiments described herein is the application of automated machine learning concepts for correlating …"
