Cites,Authors,Title,Year,Source,Publisher,ArticleURL,CitesURL,GSRank,QueryDate,Type,DOI,ISSN,CitationURL,Volume,Issue,StartPage,EndPage,ECC,CitesPerYear,CitesPerAuthor,AuthorCount,Age,Abstract
0,"MF Der","Investigating Large-Scale Internet Abuse Through Web Page Classification",2015,"","escholarship.org","https://escholarship.org/uc/item/8jp0z4m4","",43,"2021-02-09 16:40:36","","","","",,,,,0,0.00,0,1,6,"… Page 24. 3 this dissertation is that machine learning tools can fulfill precisely this demand. Automated machine learning techniques are effective solutions in part due to the regularity of replication on the Internet, where many duplicate or near-duplicate Web pages exist …"
0,"C Schaffhausen","Large-Scale Needfinding Methods, Quality Metrics, and Need Prioritization in User-Centered Design",2015,"","conservancy.umn.edu","https://conservancy.umn.edu/handle/11299/175325","",44,"2021-02-09 16:40:36","","","","",,,,,0,0.00,0,1,6,"… In part 2, a series of studies explored au- tomated duplication detection using state-of-the art natural language processing (NLP) algorithms … Part 2 (Uniqueness) Can automated machine learning algorithms detect duplication among textual need statements …"
0,"X Liu","Marketing Solutions Enabled by Big Data Using Structural Models",2015,"","pstorage-cmu-348901238291901.s3 …","http://pstorage-cmu-348901238291901.s3.amazonaws.com/12254891/MarketingSolutionsEnabledbyBigDataUsingStructuralModels.pdf","",45,"2021-02-09 16:40:36","PDF","","","",,,,,0,0.00,0,1,6,"… research. Armed with state-of-the-art data processing and analyzing techniques, I am anxious to tackle the complex real-world problems with Big Data to offer new insights on consumer behavior, firm strategies and public policy …"
10,"J Pokorný, P Škoda, I Zelinka, D Bednárek…","Big data movement: a challenge in data processing",2015,"Big Data in Complex …","Springer","https://link.springer.com/chapter/10.1007/978-3-319-11056-1_2","https://scholar.google.com/scholar?cites=16841955085287300388&as_sdt=2005&sciodt=0,5&hl=en",46,"2021-02-09 16:40:36","","","","",,,,,10,1.67,2,5,6,"… data processed, etc. Exclusions occur, eg Apache Mahout implemented on top of Hadoop brings to bear automated machine learning to finding hidden trends and otherwise unexpected or unconsidered ideas. A new approach …"
0,"M Filippi, F Agosta","Parkinson's disease and atypical parkinsonisms",2015,"Oxford Textbook of Neuroimaging","books.google.com","https://books.google.com/books?hl=en&lr=&id=qjtICgAAQBAJ&oi=fnd&pg=PA246&dq=%22automated+machine+learning%22+%22state+of+the+art%22&ots=0aC7MmrF9_&sig=8TtG-p3qjk96dUE-cW2Lvl7ZMsQ","",47,"2021-02-09 16:40:36","","","","",,,,,0,0.00,0,2,6,"Page 263. CHAPTER 21 Movement disorders Parkinson's disease and atypical parkinsonisms Massimo Filippi and Federica Agosta Introduction Idiopathic Parkinson's disease (PD) is by far the most common cause of parkinsonism …"
1,"AD Sarma, A Parameswaran, J Widom","Globally optimal crowdsourcing quality management",2015,"arXiv preprint arXiv:1502.07710","arxiv.org","https://arxiv.org/abs/1502.07710","https://scholar.google.com/scholar?cites=8483615729650072835&as_sdt=2005&sciodt=0,5&hl=en",48,"2021-02-09 16:40:36","","","","",,,,,1,0.17,0,3,6,"… 1.1 Related Literature Crowdsourcing is gaining importance as a platform for a va- riety of different applications where automated machine learning … [5], which represents the state of the art over multiple papers [9, 13, 14], show that under certain assumptions about the graph …"
0,"Y Xiao","User perceived video quality modelling on mobile devices for Vp9 and H265 encoders",2015,"","eprints.qut.edu.au","https://eprints.qut.edu.au/81842","",49,"2021-02-09 16:40:36","","","","",,,,,0,0.00,0,1,6,"… As a means of alleviating the increasing load of network infrastructure and cater for the rapidly expanding video resolution, sophisticated state-of-the-art video content compression methods such as AVS2, VP9 and H.265/HEVC (High Efficiency Video Coding) are being …"
0,"M Poussevin","Apprentissage de représentation pour des données générées par des utilisateurs",2015,"","theses.fr","https://www.theses.fr/2015PA066040","",50,"2021-02-09 16:40:36","","","","",,,,,0,0.00,0,1,6,"… the te- dious task of hand-crafting representations of the data by the design of completely automated machine learning based processing … tasks such as handwriting recogni- tion and speech recognition, recurrent neural networks [Dor96] are now state of the art models [Gra12 …"
