Cites,Authors,Title,Year,Source,Publisher,ArticleURL,CitesURL,GSRank,QueryDate,Type,DOI,ISSN,CitationURL,Volume,Issue,StartPage,EndPage,ECC,CitesPerYear,CitesPerAuthor,AuthorCount,Age,Abstract
0,"MJ SMITH, LEI XU, K VEERAMACHANENI","A Level-wise Taxonomic Perspective on Automated Machine Learning to Date and Beyond: Challenges and Opportunities",2018,"","researchgate.net","https://www.researchgate.net/profile/Shubhra_Kanti_Karmaker_Santu/publication/341252268_A_Level-wise_Taxonomic_Perspective_on_Automated_Machine_Learning_to_Date_and_Beyond_Challenges_and_Opportunities/links/5f9791e3a6fdccfd7b825d8c/A-Level-wise-Taxonomic-Perspective-on-Automated-Machine-Learning-to-Date-and-Beyond-Challenges-and-Opportunities.pdf","",205,"2021-02-09 14:33:32","PDF","","","",,,,,0,0.00,0,3,3,"… 111 A Level-wise Taxonomic Perspective on Automated Machine Learning to Date and Beyond: Challenges and Opportunities SHUBHRA … inefficient. Altogether, Automated Machine Learning systems are still far from a “real automatic system” …"
0,"KS Park, KS Hwang, KM Lee, CS Han…","Machine learning modeling assistance for non-expert developers",2019,"Proceedings of the …","dl.acm.org","https://dl.acm.org/doi/abs/10.1145/3338840.3355680","",206,"2021-02-09 14:33:32","","","","",,,,,0,0.00,0,5,2,"… There are several automated machine learning tools for supporting the AutoML … Auto-WEKA 2.0[14], which advanced version of Auto- WEKA, helps developers searching and optimizing the hyper- parameters by using the state-of-the-art Bayesian optimization method …"
0,"J Choi","Clustering and Classification Networks",2019,"arXiv preprint arXiv:1906.08714","arxiv.org","https://arxiv.org/abs/1906.08714","",207,"2021-02-09 14:33:32","","","","",,,,,0,0.00,0,1,2,"… We accomplished the result of state-of-the-art by performing the above three steps sequentially or recursively … To solve these problems, this paper proposes a tech- nique to apply automated machine learning using only fully connected layer using existing network architecture …"
58,"F Assunção, N Lourenço, P Machado…","DENSER: deep evolutionary network structured representation",2019,"Genetic Programming and …","Springer","https://link.springer.com/article/10.1007/s10710-018-9339-y","https://scholar.google.com/scholar?cites=10214573431456222236&as_sdt=2005&sciodt=0,5&hl=en",208,"2021-02-09 14:33:32","","","","",,,,,58,29.00,15,4,2,"… is the 78.75% classification accuracy on the CIFAR-100 dataset, which, to the best of our knowledge, sets a new state-of-the-art on methods … The search for approaches to automatically configure ML methods is not new, and is known as automated machine learning (AutoML) …"
2,"EM Rutter, JH Lagergren, KB Flores","A convolutional neural network method for boundary optimization enables few-shot learning for biomedical image segmentation",2019,"… with Less Labels and Imperfect Data","Springer","https://link.springer.com/chapter/10.1007/978-3-030-33391-1_22","https://scholar.google.com/scholar?cites=16786665509182385745&as_sdt=2005&sciodt=0,5&hl=en",209,"2021-02-09 14:33:32","","","","",,,,,2,1.00,1,3,2,"… We found that CoMBO is significantly more accurate than state-of-the-art machine learning methods such as Mask R-CNN … 2, right). These results suggest that CoMBO can be used to quickly and accurately annotate large datasets for fully automated machine learning methods …"
0,"SK Bhukta, E Al-Shehri, SK Singh, PK Nath…","Seismic Tools to Mitigate the Challenges of Thin Tight Carbonate Reservoir: A Case Study",2019,"Petroleum …","earthdoc.org","https://www.earthdoc.org/content/papers/10.3997/2214-4609.201902260","",210,"2021-02-09 14:33:32","","","","",,,,,0,0.00,0,5,2,"… Here, we have adapted these state of the art tools and integration of the geophysical, geological and drilling data to identify this thin tight carbonate reservoir … The automated machine learning fault likelihood and thin likelihood methods depict the orientation of the major faults …"
0,"L Rachana, S Shridevi","A literature survey: semantic technology approach in machine learning",2019,"Advances in Smart Grid Technology","Springer","https://link.springer.com/chapter/10.1007/978-981-15-7241-8_34","",211,"2021-02-09 14:33:32","","","","",,,,,0,0.00,0,2,2,"… We have also researched the automated machine learning system workflow … The review explores the current state of the art of semantic machine learning approaches and also guides us to propose a platform for facilitating the implementation and evaluation of supervised …"
5,"M Alsharqi, R Upton, A Mumith…","Artificial intelligence: a new clinical support tool for stress echocardiography",2018,"Expert review of medical …","Taylor & Francis","https://www.tandfonline.com/doi/full/10.1080/17434440.2018.1497482","https://scholar.google.com/scholar?cites=7960794830762969023&as_sdt=2005&sciodt=0,5&hl=en",212,"2021-02-09 14:33:32","HTML","","","",,,,,5,1.67,1,4,3,"… Valvular morphological quantification also appears to be possible using automated machine learning analysis of 3D transoesophageal echocardiography images of the mitral valve … Important meta-analysis summarising publications on current state of the art human opeartor …"
10,"J Thomas, S Coors, B Bischl","Automatic gradient boosting",2018,"arXiv preprint arXiv:1807.03873","arxiv.org","https://arxiv.org/abs/1807.03873","https://scholar.google.com/scholar?cites=2943418997515264691&as_sdt=2005&sciodt=0,5&hl=en",213,"2021-02-09 14:33:32","","","","",,,,,10,3.33,3,3,3,"… results of Section 4 showed that autoxgboost was outperformed on the larger number of datasets by auto-sklearn, but was able to achieve competitive results on some datasets, providing state-of-the-art performance with only a … Efficient and robust automated machine learning …"
3,"F Ahlgren, M Thern","Auto machine learning for predicting ship fuel consumption",2018,"ECOS 2018-the 31st International Conference …","diva-portal.org","https://www.diva-portal.org/smash/record.jsf?pid=diva2:1239629","https://scholar.google.com/scholar?cites=12827876069662577656&as_sdt=2005&sciodt=0,5&hl=en",214,"2021-02-09 14:33:32","","","","",,,,,3,1.00,2,2,3,"… The model is developed using state-of-the-art Auto Machine Learning tools, which optimises both the model hyper parameters and the model selection … [12] Feurer M, Klein A, Eggensperger K, Springenberg J, Blum M, Hutter F. Efficient and Robust Automated Machine Learning …"
0,"L Ighoroje","Hybrid Automated Machine Learning System for Big Data",2018,"","eprints.hud.ac.uk","http://eprints.hud.ac.uk/id/eprint/35048/","",215,"2021-02-09 14:33:32","","","","",,,,,0,0.00,0,1,3,"Page 1. University of Huddersfield Repository Ighoroje, Lamogha Hybrid Automated Machine Learning System for Big Data Original Citation Ighoroje, Lamogha (2018) Hybrid Automated Machine Learning System for Big Data. Doctoral thesis, University of Huddersfield …"
0,"S Allagi, R Rachh","Analysis of Network log data using Machine Learning",2019,"2019 IEEE 5th International Conference for …","ieeexplore.ieee.org","https://ieeexplore.ieee.org/abstract/document/9033737/","",216,"2021-02-09 14:33:32","","","","",,,,,0,0.00,0,2,2,"… The experimental results showed the accuracy of predicting the abnormal behavior was high and acceptable. This paper is organized as follows: Section 2 provides state- of the art review of the work carried out in area of network security using various approaches …"
0,"J Zutty, D Carr, R Talebi, J Rick…","Reducing bathymetric-lidar algorithm uncertainty with genetic programming and the evolutionary multi-objective algorithm design engine",2019,"… Learning for Multi …","spiedigitallibrary.org","https://www.spiedigitallibrary.org/conference-proceedings-of-spie/11006/110061U/Reducing-bathymetric-lidar-algorithm-uncertainty-with-genetic-programming-and-the/10.1117/12.2519320.full?sessionGUID=3c9d902b-c999-3ced-268b-ead49a28531a&webSyncID=46e9e6ec-7a49-dab6-a0cb-ad059329ad88&sessionGUID=3c9d902b-c999-3ced-268b-ead49a28531a","",217,"2021-02-09 14:33:32","","","","",,,,,0,0.00,0,5,2,"… Abstract. In recent years, the field of automated machine learning (autoML) has quickly attracted significant attention both in academia and industry … To ensure success in this domain, we equip EMADE with state-of-the-art techniques in the lidar signal processing domain …"
5,"JE Dartois, J Boukhobza, A Knefati…","Investigating machine learning algorithms for modeling ssd i/o performance for container-based virtualization",2019,"IEEE transactions on …","ieeexplore.ieee.org","https://ieeexplore.ieee.org/abstract/document/8636994/","https://scholar.google.com/scholar?cites=13781668407463200628&as_sdt=2005&sciodt=0,5&hl=en",218,"2021-02-09 14:33:32","","","","",,,,,5,2.50,1,4,2,"… 3.4 Learning step Choosing the right learning algorithm for a specific problem is a challenging issue. Many state-of-the-art studies such as [22] have discussed the way to select the appropriate learning algorithm(s) depending on the datasets and the type of problem to solve …"
1,"S Dyrmishi, R Elshawi, S Sakr","A Decision Support Framework for AutoML Systems: A Meta-Learning Approach",2019,"2019 International Conference …","ieeexplore.ieee.org","https://ieeexplore.ieee.org/abstract/document/8955514/","https://scholar.google.com/scholar?cites=9854070650799032865&as_sdt=2005&sciodt=0,5&hl=en",219,"2021-02-09 14:33:32","","","","",,,,,1,0.50,0,3,2,"… In the context of the Automated Machine Learning (AutoML) process, one main advantage of meta-learning techniques is that they allow hand-engineered algorithms to be replaced with novel automated methods which are designed in a data-driven way …"
1,"F Ahlgren","Reducing ships' fuel consumption and emissions by learning from data",2018,"","diva-portal.org","https://www.diva-portal.org/smash/record.jsf?pid=diva2:1261368","https://scholar.google.com/scholar?cites=16578289853555757697&as_sdt=2005&sciodt=0,5&hl=en",220,"2021-02-09 14:33:32","HTML","","","",,,,,1,0.33,1,1,3,"… The model is developed using state-of-the-art Auto Machine Learning tools, which optimises both the model hyper parameters and the … 17 Last updated: 2020-10-23Bibliographically approved. 3. Predicting dynamic fuel oil consumption on ships with automated machine learning …"
2,"Y Liu, Z Cheng, J Liu, B Yassin, Z Nan, J Luo","AI for Earth: Rainforest Conservation by Acoustic Surveillance",2019,"arXiv preprint arXiv …","arxiv.org","https://arxiv.org/abs/1908.07517","https://scholar.google.com/scholar?cites=13387291396615584056&as_sdt=2005&sciodt=0,5&hl=en",221,"2021-02-09 14:33:32","","","","",,,,,2,1.00,0,6,2,"… The proposed audio classi cation models can be easily extended in an automated machine learning paradigm and integrated in cloud- based services for … Taking human capability of 81.3% accuracy on this task as a reference, the current state-of-the-art [7] listed on the dataset …"
0,"J Bogatinovski","Automating machine learning for structured output prediction",2018,"","","","",222,"2021-02-09 14:33:32","CITATION","","","",,,,,0,0.00,0,1,3,""
0,"J van Hoof","Automated machine learning with gradient boosting and meta-learning",,"research.tue.nl","","https://research.tue.nl/files/125738114/Thesis_Jeroen_van_Hoof.pdf","",223,"2021-02-09 14:33:32","PDF","","","",,,,,0,0.00,0,1,,"… 1.2 Goals The goal of this work is to improve upon the current state-of-the-art automated machine learning tools. We will use AutoSklearn [9] as our baseline state-of-the-art AutoML tool to compare against. AutoSklearn improved …"
21,"A Sano, W Chen, D Lopez-Martinez…","Multimodal ambulatory sleep detection using lstm recurrent neural networks",2018,"IEEE journal of …","ieeexplore.ieee.org","https://ieeexplore.ieee.org/abstract/document/8449917/","https://scholar.google.com/scholar?cites=10376077354901765550&as_sdt=2005&sciodt=0,5&hl=en",224,"2021-02-09 14:33:32","","","","",,,,,21,7.00,5,4,3,"… and sleep onset/offset detection to (1) non-temporal machine learning methods and (2) a state-of-the-art actigraphy software … This paper makes several novel contributions: • We develop a fully automated machine learning algorithm for (i) sleep/wake classification and (ii) sleep …"
6,"Z Wang, SVR Sadda, Z Hu","Deep learning for automated screening and semantic segmentation of age-related and juvenile atrophic macular degeneration",2019,"Medical Imaging 2019: Computer …","spiedigitallibrary.org","https://www.spiedigitallibrary.org/conference-proceedings-of-spie/10950/109501Q/Deep-learning-for-automated-screening-and-semantic-segmentation-of-age/10.1117/12.2511538.short","https://scholar.google.com/scholar?cites=4334043944837493846&as_sdt=2005&sciodt=0,5&hl=en",225,"2021-02-09 14:33:32","","","","",,,,,6,3.00,2,3,2,"… Recently, automated machine learning-based approaches have become the preferred technique for image segmentation and analysis … U-Net (called U-Net based on its unique U shape) is a state-of-the-art deep learning algorithm for semantic segmentation and relies on an …"
0,"FGB Schut, JN van Rijn, HH Hoos","Towards Automated Technical Analysis for Foreign Exchange Data",,"ada.liacs.leidenuniv.nl","","https://ada.liacs.leidenuniv.nl/papers/SchEtAl19.pdf","",226,"2021-02-09 14:33:32","PDF","","","",,,,,0,0.00,0,3,,"… Keywords: Automated Machine Learning, meta-learning, Foreign Ex- change, Automated Trading … Our contribu- tions are as follows: (i) We apply state-of-the-art hyperparameter optimization techniques (including Auto-sklearn) to the various datasets and report on per- formance …"
0,"A Müller","Hyperparameter Importance for Image Classification by Residual Neural Networks",2019,"Discovery Science: 22nd International Conference, DS …","books.google.com","https://books.google.com/books?hl=en&lr=&id=IsO3DwAAQBAJ&oi=fnd&pg=PA112&dq=%22automated+machine+learning%22+%22state+of+the+art%22&ots=TyuLJOL_JF&sig=vEh3BLcQdKbL38WZer4F3cPUULY","",227,"2021-02-09 14:33:32","","","","",,,,,0,0.00,0,1,2,"… Residual neural networks (ResNets) are among the state- of-the-art for image classification tasks. With the advent of automated machine learning (AutoML), automated hyperparameter optimization methods are by now routinely used for tuning various network types …"
0,"M Radic","Quantum-enhanced Machine Learning in the NISQ era",2019,"","elib-m.09gps.com","https://elib-m.09gps.com/handle/11682/10642","",228,"2021-02-09 14:33:32","","","","",,,,,0,0.00,0,1,2,"… Supervised Learning and Reinforcement Learning are touched upon followed by a brief introduction into methods of automated Machine Learning … a high number of layers, along with nonlinear transformations between them, is successfully used for state-of-the-art methods in …"
3,"G Gautam, A Raj, S Mukhopadhyay","Identifying twins based on ocular region features using deep representations",2019,"Applied Intelligence","Springer","https://link.springer.com/content/pdf/10.1007/s10489-019-01562-w.pdf","https://scholar.google.com/scholar?cites=8001652736049902182&as_sdt=2005&sciodt=0,5&hl=en",229,"2021-02-09 14:33:32","","","","",,,,,3,1.50,1,3,2,"… classification. Our proposed frameworks outperform all the state-of-the-art methods. 2 Methodology … problem. This network, being a part of Automated machine learning (AutoML), automates the design of machine learning models …"
3,"AN Harutyunyan, AV Poghosyan…","Learning baseline models of log sources",2018,"… and Data Science in …","books.google.com","https://books.google.com/books?hl=en&lr=&id=9DdqDwAAQBAJ&oi=fnd&pg=PA145&dq=%22automated+machine+learning%22+%22state+of+the+art%22&ots=4BFZVBRz7W&sig=gPVh9acJ3LgJixbiDzqORYzN3YM","https://scholar.google.com/scholar?cites=15697160531084009441&as_sdt=2005&sciodt=0,5&hl=en",230,"2021-02-09 14:33:32","","","","",,,,,3,1.00,1,3,3,"… the modern Software-Defined Data Center manage- ment with automated machine learning capabilities, self-tuning and optimization, and move forward into an AI-enabled autonomous management in the cloud computing marNet. For vR Ops, the current state-of-the-art in terms …"
34,"K Eggensperger, M Lindauer, HH Hoos, F Hutter…","Efficient benchmarking of algorithm configurators via model-based surrogates",2018,"Machine Learning","Springer","https://link.springer.com/article/10.1007/s10994-017-5683-z","https://scholar.google.com/scholar?cites=6246538659115788703&as_sdt=2005&sciodt=0,5&hl=en",231,"2021-02-09 14:33:32","HTML","","","",,,,,34,11.33,7,5,3,"… 2016) and SMAC (Hutter et al. 2011b) have been shown to substantially improve the performance of state-of-the-art algorithms for a wide range of combinatorial problems including SAT (Hutter et al. 2007, 2017), answer set programming (Gebser et al. 2011; Silverthorn et al …"
0,"R Zhang, N El-Gohary","A machine learning-based method for building code requirement hierarchy extraction",2019,"2019 Canadian Society for Civil Engineering …","csce.ca","https://www.csce.ca/elf/apps/CONFERENCEVIEWER/conferences/2019/pdfs/PaperPDFversion_147_0423081134.pdf","",232,"2021-02-09 14:33:32","PDF","","","",,,,,0,0.00,0,2,2,"… These rule-based methods have achieved the state- of-the-art performance, and only require limited human effort … which can be used to convert complex requirements into hierarchies of much simpler requirement units to facilitate automated machine learning-based processing …"
8,"M Adamou, G Antoniou, E Greasidou…","Mining free-text medical notes for suicide risk assessment",2018,"Proceedings of the 10th …","dl.acm.org","https://dl.acm.org/doi/abs/10.1145/3200947.3201020","https://scholar.google.com/scholar?cites=16853649407659093659&as_sdt=2005&sciodt=0,5&hl=en",233,"2021-02-09 14:33:32","","","","",,,,,8,2.67,2,4,3,"… KEYWORDS automated machine learning, suicide prevention, risk assessment tool, clinical data, text mining … A companion paper [1] reports an analysis which used state of the art machine learning for structured data but a simple text- mining approach (bag-of-words) …"
3,"J Brunk, M Niemann, DM Riehle","Can analytics as a service save the online discussion culture?-The case of comment moderation in the media industry",2019,"2019 IEEE 21st Conference …","ieeexplore.ieee.org","https://ieeexplore.ieee.org/abstract/document/8808072/","https://scholar.google.com/scholar?cites=1633063888125553373&as_sdt=2005&sciodt=0,5&hl=en",234,"2021-02-09 14:33:32","","","","",,,,,3,1.50,1,3,2,"… But even with a powerful state-of-the art classifier at hand, there are further aspects that will require attention: To identify the correct parameter configuration for the algorithm to perform … Another viable alternative could be the concept of automated machine learning (AutoML) …"
1,"E Fasllija, HF Enişer, B Prünster","Phish-Hook: Detecting Phishing Certificates Using Certificate Transparency Logs",2019,"… Conference on Security and Privacy in …","Springer","https://link.springer.com/chapter/10.1007/978-3-030-37231-6_18","https://scholar.google.com/scholar?cites=12563692059127091728&as_sdt=2005&sciodt=0,5&hl=en",235,"2021-02-09 14:33:32","","","","",,,,,1,0.50,0,3,2,"… They do not employ any automated machine-learning based detection mechanism, but rather base their phishing detection approach on regular … In addition, we advance the current state of the art with respect to detecting fraudulent websites fitted with genuine certificates by …"
0,"G Kanishka","A Review of Machine Learning Techniques for Diabetes Prediction in Healthcare",2019,"Journal of the Gujarat Research Society","gujaratresearchsociety.in","http://gujaratresearchsociety.in/index.php/JGRS/article/view/3062","",236,"2021-02-09 14:33:32","","","","",,,,,0,0.00,0,1,2,"… III. LITERATURE REVIEW This section surveys the current state-of-the-art literature as for diabetes prediction system dependent on big data analysis … [3] Hutter, Frank, Lars Kotthoff, and Joaquin Vanschoren. Automated Machine Learning. Springer: New York, NY, USA, 2019 …"
1,"EFS Soares, H Salehinejad…","Recurrent Neural Networks for Online Travel Mode Detection",2019,"2019 IEEE Global …","ieeexplore.ieee.org","https://ieeexplore.ieee.org/abstract/document/9013316/","https://scholar.google.com/scholar?cites=12590021592534590060&as_sdt=2005&sciodt=0,5&hl=en",237,"2021-02-09 14:33:32","","","","",,,,,1,0.50,0,3,2,"… We also present a quantitative eval- uation of the proposed architecture and other state-of-the- art machine learning models … Klein, Katharina Eggensperger, Jost Springen- berg, Manuel Blum, and Frank Hutter, “Efficient and robust automated machine learning,” in Advances in …"
3,"R He, S Yang, J Yang, J Cao","Automated Mining of Approximate Periodicity on Numeric Data: A Statistical Approach",2018,"… of the 2nd International Conference on …","dl.acm.org","https://dl.acm.org/doi/abs/10.1145/3193077.3194509","https://scholar.google.com/scholar?cites=10680363223902342214&as_sdt=2005&sciodt=0,5&hl=en",238,"2021-02-09 14:33:32","","","","",,,,,3,1.00,1,4,3,"… grow rapidly, the complexity of these tasks often goes beyond non-experts, people would like automated machine learning methods that … approach, we apply our periodicity detection algorithm on simulated sequences and compare its performance with state-of-the-art time series …"
11,"M Cearns, T Hahn, BT Baune","Recommendations and future directions for supervised machine learning in psychiatry",2019,"Translational psychiatry","nature.com","https://www.nature.com/articles/s41398-019-0607-2","https://scholar.google.com/scholar?cites=16761646332255839781&as_sdt=2005&sciodt=0,5&hl=en",239,"2021-02-09 14:33:32","HTML","","","",,,,,11,5.50,4,3,2,"Machine learning methods hold promise for personalized care in psychiatry, demonstrating the potential to tailor treatment decisions and stratify patients into clinically meaningful taxonomies. Subsequently, publication counts applying machine learning methods have risen, with …"
4,"W Ni, T Liu, Q Zeng, X Zhang, H Duan, N Xie","Robust factorization machines for credit default Prediction",2018,"Pacific Rim International …","Springer","https://link.springer.com/chapter/10.1007/978-3-319-97304-3_72","https://scholar.google.com/scholar?cites=7783723467578109823&as_sdt=2005&sciodt=0,5&hl=en",240,"2021-02-09 14:33:32","","","","",,,,,4,1.33,1,6,3,"… Baselines. To verify the advantage of the proposed RobustFM, we compare it with several state-of-the-art credit default prediction models … Further study should be continued to apply automated machine learning techniques to derive the optimal hyper-parameters automatically …"
0,"M Rostami Osanloo","Classification of Extragalactic X-ray Sources Using Machine Learning Method",2019,"","digital.library.txstate.edu","https://digital.library.txstate.edu/handle/10877/12880","",241,"2021-02-09 14:33:32","","","","",,,,,0,0.00,0,1,2,"… Therefore, creating an automated Machine Learning (ML) tool for classification of extragalactic X-ray sources with multi-wavelength data will enable us to understand X-ray source … It contains a number of state-of-the-art ML algorithms, as well as comprehensive documen …"
35,"J Dekhtiar, A Durupt, M Bricogne, B Eynard…","Deep learning for big data applications in CAD and PLM–Research review, opportunities and case study",2018,"Computers in …","Elsevier","https://www.sciencedirect.com/science/article/pii/S0166361517305560","https://scholar.google.com/scholar?cites=3604333355404019807&as_sdt=2005&sciodt=0,5&hl=en",242,"2021-02-09 14:33:32","","","","",,,,,35,11.67,7,5,3,"… These recent advances in machine learning and deep learning offer the manufacturing industry tools and techniques reaching, at this date, some of the best performances in the current state-of-the-art to tackle the aforesaid recurring challenges. This paper aims to: • …"
41,"H Jin, Q Song, X Hu","Auto-keras: Efficient neural architecture search with network morphism",2018,"arXiv preprint arXiv:1806.10282","researchgate.net","https://www.researchgate.net/profile/Haifeng_Jin2/publication/326029461_Efficient_Neural_Architecture_Search_with_Network_Morphism/links/5c897ecc299bf14e7e7ad3a5/Efficient-Neural-Architecture-Search-with-Network-Morphism.pdf","https://scholar.google.com/scholar?cites=16096746288708673197&as_sdt=2005&sciodt=0,5&hl=en",243,"2021-02-09 14:33:32","PDF","","","",,,,,41,13.67,14,3,3,"… the-art methods. Moreover, we build an open-source AutoML system on our method, namely Auto-Keras2. The system runs in parallel on CPU and GPU, with an adaptive search strategy for different GPU memory limits. 1 INTRODUCTION Automated Machine Learning (AutoML …"
0,"J Zutty, JR Rodd Talebi, C Valenta, D Carr, G Rohling","BathEMADE: Evolutionary Multi-objective Algorithm Design Engine for Bathymetric LIDAR",,"sto.nato.int","","https://www.sto.nato.int/publications/STO%20Meeting%20Proceedings/STO-MP-SET-262/MP-SET-262-07.pdf","",244,"2021-02-09 14:33:32","PDF","","","",,,,,0,0.00,0,5,,"… In recent years, the field of automated machine learning (autoML) has quickly attracted a significant amount of attention both in academia and … We created a processing architecture that involves using the state-of-the-art interest point method as a trigger for a machine learning …"
14,"YS Ong, A Gupta","AIR5: Five Pillars of Artificial Intelligence Research",2019,"IEEE Transactions on Emerging Topics in …","ieeexplore.ieee.org","https://ieeexplore.ieee.org/abstract/document/8782800/","https://scholar.google.com/scholar?cites=9486975699267667614&as_sdt=2005&sciodt=0,5&hl=en",245,"2021-02-09 14:33:32","","","","",,,,,14,7.00,7,2,2,"… In this regard, it is worth noting that although DNNs are (rightly) considered to be state-of-the-art among ML techniques, they do not … The overall approach falls under the scope of so-called AutoML (automated machine learning [39]), a topic that has recently been attracting …"
